"id","author","authorLink","authorThumb","text","likes","time","timestamp","edited","hasReplies","repliesToken","numReplies","reply.id","reply.author","reply.authorLink","reply.authorThumb","reply.text","reply.likes","reply.time","reply.timestamp","reply.edited"
"UgyCV9j7D_GKiV61LYl4AaABAg","Silk Chaudhary","/channel/UCVT3QpQWHHPr44Ldd-AVqJg","https://yt3.ggpht.com/a/AATXAJwo9LY6GzBNPBewqscrcqbTIsCc2L5sVMrdQg=s48-c-k-c0xffffffff-no-rj-mo","Arey.. where is Frank's mustache and beard 😂😁😂😁",2,"5 months ago",1571495450784,false,false,,,,,,,,,,,
"Ugz2J1ec7TTQunsoayx4AaABAg","RyanPatrick","/channel/UCqbOKlHWHgcUZZ7tKC_InyQ","https://yt3.ggpht.com/a/AATXAJyI_MspTuKN10HKlg6hYGB3c8dqnAnhMoKNCg=s48-c-k-c0xffffffff-no-rj-mo","""the big big chair!""",0,"1 year ago",1553005850786,false,false,,,,,,,,,,,
"Ugw381EXZxwApKF_LTV4AaABAg","chetan naik","/channel/UCGPvKuMIG9Qd0tjadFNSRrA","https://yt3.ggpht.com/a/AATXAJwWYhZpwOG-FdzeEwLEZK3YHHxXpz9vI-ZUYw=s48-c-k-c0xffffffff-no-rj-mo","Chetan Chauhan still uses Reynolds pen.",0,"1 year ago",1553005850788,false,false,,,,,,,,,,,
"UgwZoWl7fAYks1MbVr14AaABAg","somi somi","/channel/UCTRaG1-LHl-XrJwCsCvNI4A","https://yt3.ggpht.com/a/AATXAJxm-yVWy3D1U--DOZL87jq1qCjGbZtXiw4gtw=s48-c-k-c0xffffffff-no-rj-mo","As the IPCC report released.. and the US moves out from the Paris agreement... the main pressure is on China and India to move away from high emission based fossil fuel based economy... to achieve 1.5-degree Celsius but present commitment is not much tight.. sci and technology permit ur to cut the emission but there is a big gap b/w science and politics.. developed countries are not much serious... we need 45% emission removal.. to achieve the target... drought in north india.. flood in kerala.. heat wave in Europe forest fire in California so on and so forth it is difficult to retrieve the situation.. in world over in different form env. is reminding us to save humanity ... The US and China two biggest emitter.. around 45% of carbon emissions..and China further want to increase the emission. and the US removed out.. Canada moved out of Kyoto protocol... Russia Japan Germany missed their targets.... we are facing the alarming situation. Kyoto protocol over and Kyoto protocol two is not ratified... it indicates the Kyoto model is failed... in Paris agreement option is given to the new regime... evolve their own method to decrease carbon emission.. flexibility is given acc to the social situation of their county by problem sharing phenomena...  \n\nfor India specific... we have to highlight the scientific temper to create awareness among people for adopting cleaner energy... govt should installed a mechanism to promote cleaner energy with implementation... Govt must also promote on climate research in India centric... as we are doing some good in the solar alliance... but we have to change the mindset for our future prosperity and sustainable development... our policy needs to be aligned in multiple disciplinary ways to dictate climate change..",0,"1 year ago",1553005850789,false,false,,,,,,,,,,,
"Ugz9OMaeU0QrVv5LfBx4AaABAg","I'm good","/channel/UCvS1tsEPEBAM_2g3PGaQ_1Q","https://yt3.ggpht.com/a/AATXAJyBpIsX62XvTZssuqJI6VK44UrnLFbK0Im7OQ=s48-c-k-c0xffffffff-no-rj-mo","Please try to bring Prof. Vinod Tare from IIT Kanpur.",0,"1 year ago",1553005850790,false,false,,,,,,,,,,,
"Ugy9k3Qyue8XOf3gQOF4AaABAg","I'm good","/channel/UCvS1tsEPEBAM_2g3PGaQ_1Q","https://yt3.ggpht.com/a/AATXAJyBpIsX62XvTZssuqJI6VK44UrnLFbK0Im7OQ=s48-c-k-c0xffffffff-no-rj-mo","bring down the human population. Careless and useless youth of India, youths have come here also only for fodder materials for their essays, they would do nothing.",1,"1 year ago",1553005850791,true,true,"EkQSC2t5TnpLWkhLMHowwAEAyAEA4AEBogINKP___________wFAAMICGxoXaHR0cHM6Ly93d3cueW91dHViZS5jb20iABgGMk0aSxIaVWd5OWszUXl1ZThYT2YzZ1FPRjRBYUFCQWciAggAKhhVQ0lTZ25TTndxUTJpOGxoQ3VuM0t0UWcyC2t5TnpLWkhLMHowQAFICg%3D%3D",1,,,,,,,,,
,,,,,,,,,,,,"Ugy9k3Qyue8XOf3gQOF4AaABAg.8metj_BjpHK8mmVyJLamkP","Koushik Worldian","/channel/UCtK1VaBGEgbzMjeYTVfUyAg","https://yt3.ggpht.com/a/AATXAJxJ2wsiufi7XnuTT0a2tYa3OxinAMPp9NbPfA=s32-c-k-c0xffffffff-no-rj-mo","I'm good agreed 👍",1,"1 year ago",1553005851087,false
"UgxwJgxQWIPBUJIJrqJ4AaABAg","Rohit Kumar","/channel/UCjtviKF4umB5ex_TierocXQ","https://yt3.ggpht.com/a/AATXAJzTzTTRAh-K0Z6pmCOmdvkV4Ehm8PeayDjopw=s48-c-k-c0xffffffff-no-rj-mo","Thanku Mr. F.R...p ,,,, For providing us good debate ,,, Thanku Professor ,  for putting your clear vision on climate changeand rest panel ,,,,,,,",0,"1 year ago",1553005850793,false,false,,,,,,,,,,,
"Ugz3RRmgaK1mGK6ceSV4AaABAg","Prashant Khote","/channel/UCgQma5StxXdGhtiwlF7wQCg","https://yt3.ggpht.com/a/AATXAJxNGnHN_txshNDV1iAuxcezHOMZ23SCOKgRlg=s48-c-k-c0xffffffff-no-rj-mo","prof. C K Varshney  is really one of the clever panalist in BIG PICTURE.",0,"1 year ago",1553005850794,false,false,,,,,,,,,,,
"UgxuLLoLN3s9g-RR-J94AaABAg","Suman Nath","/channel/UCKK0L3N-ABOao2t6tGX8sJQ","https://yt3.ggpht.com/a/AATXAJwcXSOvfhh9D8EIO00DXICHt1nnWuehTy1vnQ=s48-c-k-c0xffffffff-no-rj-mo","1/3 ice caps melted between 2011 and 2018. India needs to stop its emition to keep its positive image as emerging market to attract investors. Govt should put more discounts at in grid solar installations for domestic revolustion.",0,"1 year ago",1553005850795,true,false,,,,,,,,,,,
"Ugx53kRLFDi9X2mqoqZ4AaABAg","Simon Ruszczak","/channel/UCOwH74qcARVFv1YnNykPeWQ","https://yt3.ggpht.com/a/AATXAJz4BIe43BrrM3SeGumaiaNug-m1khEiSE1Jdg=s48-c-k-c0xffffffff-no-rj-mo","GloBULL warming is white man bullshit\n\nग्लोबबुल वार्मिंग सफेद आदमी बकवास है",1,"1 year ago",1553005850796,false,false,,,,,,,,,,,
"UgyYtZylDRiYikhEq7x4AaABAg","Phunkha Boro","/channel/UCXEGq_bUeeWzaR_rOigBbUQ","https://yt3.ggpht.com/a/AATXAJyb58b8HbID26O3CKEMjJ6C5EjCzmABLWE4xg=s48-c-k-c0xffffffff-no-rj-mo",">> \n- Move towards clean fuel\n- Strengthen ISA \n- Strengthen International Cooperation\n- Awareness + education\n- Invest in R & D \n- Afforestation\n- move towards e-mobility among others. \nThanks RSTV",1,"1 year ago",1553005850797,false,false,,,,,,,,,,,
"Ugy9RCmtIJDza5a51Rp4AaABAg","dhiraj bankar","/channel/UCmbAxaJyiweFjyvnW_gYu_w","https://yt3.ggpht.com/a/AATXAJyhtYntSn1Vvo6ChBGRQcEAzseXH0dE_IHHGg=s48-c-k-c0xffffffff-no-rj-mo","good topic.nice debate.\ngood to hear prof.varshney.\ntnx rs tv",0,"1 year ago",1553005850798,false,false,,,,,,,,,,,
"Ugz1CU4sQAzrpHA_IJJ4AaABAg","vidushi pandey","/channel/UCzmxhMF2KVuvCJSzmNNdIyQ","https://yt3.ggpht.com/a/AATXAJzhIExVv74Z4k69qGtB09LMbwRFBVfGcXQXlg=s48-c-k-c0xffffffff-no-rj-mo","There is no dearth of technology. It's only the implementation is what has been lacking. The government is trying to implement the measly 2-3% blending of ethanol with petrol since the early 2000s and even that has not been achieved whereas Brazil and other  Countries are already running on 100% ethanol. Unless and until government pulls up it's socks and starts working on ground rather than focussing on useless politics nothing can happen.",3,"1 year ago",1553005850799,true,false,,,,,,,,,,,
"Ugz32UCHKx-lmndVb114AaABAg","Avnish Kumar","/channel/UCzGjbuJQken7JnQMvwc3x7Q","https://yt3.ggpht.com/a/AATXAJwHb11hOPAuFrr39viLl92D_nT6hZGVRIbidA=s48-c-k-c0xffffffff-no-rj-mo","Without large GHG emittors like USA and western European countries contribution and close cooperation with third world countries implementation of   Paris promise and IPCC prediction would be difficult and non feasible.",0,"1 year ago",1553005850800,false,true,"EkQSC2t5TnpLWkhLMHowwAEAyAEA4AEBogINKP___________wFAAMICGxoXaHR0cHM6Ly93d3cueW91dHViZS5jb20iABgGMk0aSxIaVWd6MzJVQ0hLeC1sbW5kVmIxMTRBYUFCQWciAggAKhhVQ0lTZ25TTndxUTJpOGxoQ3VuM0t0UWcyC2t5TnpLWkhLMHowQAFICg%3D%3D",1,,,,,,,,,
,,,,,,,,,,,,"Ugz32UCHKx-lmndVb114AaABAg.8mMvf8zy0O08oF9fLJCw6W","Bitchin Bob","/channel/UCR1vHH6lYZIhOyNpXVHpzRg","https://yt3.ggpht.com/a/AATXAJyMzIopkNMiuSPQqd9euZe-ZOHdszWDvXL4tA=s32-c-k-c0xffffffff-no-rj-mo","Get a job you bum.",0,"1 year ago",1553005851112,false
"UgyCM1GowNmOgWqLFp14AaABAg","Vasanthi Acharya","/channel/UCmXlL9xYiKDdQ4eyFPFi0NQ","https://yt3.ggpht.com/a/AATXAJz8YT3TKiMomNRdNUrW-FuQflT8ys9PzDOPDw=s48-c-k-c0xffffffff-no-rj-mo","Rstv pls make more programmes based on climate change...it will definitely be counted as your contribution towards tackling climate change..",3,"1 year ago",1553005850802,false,false,,,,,,,,,,,
"UgxB3UBGCoC1KE2ouX14AaABAg","AMAN KUMAR","/channel/UC8ASDYSDZf2Gd2H3Kav-rCQ","https://yt3.ggpht.com/a/AATXAJxkoE075aGBLM4qtEepMJ0ZG1MUp9qowz7IiA=s48-c-k-c0xffffffff-no-rj-mo","Any uspc aspirant??",2,"1 year ago",1553005850803,false,false,,,,,,,,,,,
"UgzcXolR1BNvhdmQSXF4AaABAg","Yogesh Kumar Sah","/channel/UCzzHAxhMwmTKEXNFBDhjksQ","https://yt3.ggpht.com/a/AATXAJwDtPuqQXGCcb0vF3-s22nPDFWDBSVALN80zw=s48-c-k-c0xffffffff-no-rj-mo","can anyone tell me rstv big picture schedule in a week?",0,"1 year ago",1553005850804,false,false,,,,,,,,,,,
"Ugz65Xa1nxFmmZ-Xah94AaABAg","Bhanu Y","/channel/UCnIQa63KizFiOf4MXvY7chQ","https://yt3.ggpht.com/a/AATXAJwpcsFMCOdOFiP-FN9Zbzsf7-Vb_7FjqA1QTA=s48-c-k-c0xffffffff-no-rj-mo","Carbon emissions main cause",1,"1 year ago",1553005850805,false,false,,,,,,,,,,,
"UgxG5DrE39cPqB3mZGV4AaABAg","Monika Dahe","/channel/UC5Qq-lYFhdMWaI9Yh9Ofvgw","https://yt3.ggpht.com/a/AATXAJyD7ekisAkMckxWhSErBBbs5y53LbvYgboLxA=s48-c-k-c0xffffffff-no-rj-mo","There should be a national mission for increasing d "" Scientific Temper ""..among mass.\nIt vil sort many problms of individual health related n environment protection   n disaster management ......people dont have much awareness...so they dnt evn think abt tht...n implementation to door ki baat h phir......it vil generate strong n effective view point then  imp steps wil be taken by d individual, community too..",1,"1 year ago",1553005850806,false,true,"EkQSC2t5TnpLWkhLMHowwAEAyAEA4AEBogINKP___________wFAAMICGxoXaHR0cHM6Ly93d3cueW91dHViZS5jb20iABgGMk0aSxIaVWd4RzVEckUzOWNQcUIzbVpHVjRBYUFCQWciAggAKhhVQ0lTZ25TTndxUTJpOGxoQ3VuM0t0UWcyC2t5TnpLWkhLMHowQAFICg%3D%3D",1,,,,,,,,,
,,,,,,,,,,,,"UgxG5DrE39cPqB3mZGV4AaABAg.8mGeCtUO0za8mmVXXA1pBc","Koushik Worldian","/channel/UCtK1VaBGEgbzMjeYTVfUyAg","https://yt3.ggpht.com/a/AATXAJxJ2wsiufi7XnuTT0a2tYa3OxinAMPp9NbPfA=s32-c-k-c0xffffffff-no-rj-mo","Monika Dahe everyone knows the solution. here the only choking point is WHO WILL BELL THE CAT??",0,"1 year ago",1553005851107,false
"Ugz5YutIgOm-xopdykV4AaABAg","mp samy","/channel/UC7WysL6FSdn5p1S7Qzx3Mqg","https://yt3.ggpht.com/a/AATXAJz796rG8p3wWam3rOCW1fZZDc5VpTjgO7tP1w=s48-c-k-c0xffffffff-no-rj-mo","Good discussion about #Climate change",0,"1 year ago",1553005850807,false,false,,,,,,,,,,,
"Ugx3CY1qGfyBHalXef54AaABAg","Alen Joshy","/channel/UC-Gxu1sP2KgAFj5VU97W8Tg","https://yt3.ggpht.com/a/AATXAJy-4hPJejcXFEk0LtFWGBJUh4hWqcrqlBUHIg=s48-c-k-c0xffffffff-no-rj-mo","A great place to begin :)\nhttp://greatwavesofchange.org/",0,"1 year ago",1553005851609,false,false,,,,,,,,,,,
"UgzTJDpyExd591lsjzh4AaABAg","Anshul Khatri","/channel/UCcBU0bf9B9djXXk-CSZju0A","https://yt3.ggpht.com/a/AATXAJyCUUu7B1-N5fpThpjUGkWhsqDbLJnnaIzYGg=s48-c-k-c0xffffffff-no-rj-mo","Professor rocks warm regards to the professor steal the show 😎😇👨",0,"1 year ago",1553005851611,false,false,,,,,,,,,,,
"UgyugZp-UpgcOskukB54AaABAg","Extension Flexxin","/channel/UCn55vyohXSoKCVwqD546otQ","https://yt3.ggpht.com/a/AATXAJxXmIdVGox53Doz1UcDM27rs3IO78ziHPxjHA=s48-c-k-c0xffffffff-no-rj-mo","Climate change isn’t real for the 100th time. This is disinformation for what is coming. What is real is HAARP and geo engineering. We control our weather 100% . The US and China have both weaponized it , im sure others have aswell. And it’s going to be what destroys us all. wake the fuck up",0,"1 year ago",1553005851612,false,false,,,,,,,,,,,
"UgwzW-QjXlbMf5dxgoB4AaABAg","pulkit dua","/channel/UCe3MyYRYPphC7739dBSCNaA","https://yt3.ggpht.com/a/AATXAJyZDXtvBD5n9U1SarX1-6dD0YJSy3a47yuuDQ=s48-c-k-c0xffffffff-no-rj-mo","Haha that’s climatic colonisation........Usa Europe population near replacement rates and in indo China we make 50% of global population which only serves those elite nations while destroying our environment and nature and have made women factories of baby 🍼 production who are all skillless poor and huge assets for capitalist to make great profits meanwhile rich nations take mitigation’s to protect their populace we continue to produce babies cutting our neck with our own knife........purvanchalees shld be under necessary family planning and all those poor who have more then one boy and girl otherwise these poor are the ones who will be extinct first since govt talks of food security but threw only a good laugh over it",0,"1 year ago",1553005851613,false,false,,,,,,,,,,,
"UgzjB6kit1YIhWBbDPB4AaABAg","High school Hotty","/channel/UCNmVqGNfMdx9VG2hKutTo3Q","https://yt3.ggpht.com/a/AATXAJxdiO2a9yJIB_e9OHvVzrgpNMJiz_SUTI7GkQ=s48-c-k-c0xffffffff-no-rj-mo","Cuba did great on fixing old cars , NOT creating the carbon foot print of buying new. CONVERT ALL COMBUSTION CARS TO E.V'S ONLY, DEEP DRILL FOR GEO-HEAT ENERGY TO MAKE STEAM FOR POWER PLANT GENERATORS, NO MORE BURNING OF OIL GAS OR COAL.",0,"1 year ago",1553005851614,false,false,,,,,,,,,,,
"UgzTUKx4kzAVexM6RKd4AaABAg","High school Hotty","/channel/UCNmVqGNfMdx9VG2hKutTo3Q","https://yt3.ggpht.com/a/AATXAJxdiO2a9yJIB_e9OHvVzrgpNMJiz_SUTI7GkQ=s48-c-k-c0xffffffff-no-rj-mo","Do not attach money to saving the world. ALL countries have to make illegal fossil fuel burning, and enlist militaries and conscripts from other  groups to make solar shingle roofs and panels, deep drilling for geothermal power, manufacture tide wind and river dams etc. --- DEMONITIZE THE SAVING OF OUR BIOSPHERE - FUTURE CIVILIZATIONS WON'T USE MONEY, SO WE SHOULD NOT EITHER.",0,"1 year ago",1553005851615,false,false,,,,,,,,,,,
"UgzYi6CFxwmqodlqL394AaABAg","invincible will","/channel/UCRf7WZVOyF3UdEbrxZZ-wrw","https://yt3.ggpht.com/a/AATXAJz93ikbWcDgmon_RweRW50r5TOQ9NptVD45xA=s48-c-k-c0xffffffff-no-rj-mo","#Only prof ck varshney provide some fodder material for students others were beating around the bush...",3,"1 year ago",1553005851617,false,false,,,,,,,,,,,
"UgxAQek-jpZodH4OA-B4AaABAg","NotMe,","/channel/UC58hT553sreX6BKWcOfjROw","https://yt3.ggpht.com/a/AATXAJxCbPd3Kawu6SQUbiXBkJ08kY7J4qt9GaboJA=s48-c-k-c0xffffffff-no-rj-mo","Americans only pay attention when problems inconvenience thier way of life. Unfortunately it's usually too late.",0,"1 year ago",1553005851617,false,true,"EkQSC2t5TnpLWkhLMHowwAEAyAEA4AEBogINKP___________wFAAMICGxoXaHR0cHM6Ly93d3cueW91dHViZS5jb20iABgGMk0aSxIaVWd4QVFlay1qcFpvZEg0T0EtQjRBYUFCQWciAggAKhhVQ0lTZ25TTndxUTJpOGxoQ3VuM0t0UWcyC2t5TnpLWkhLMHowQAFICg%3D%3D",2,,,,,,,,,
,,,,,,,,,,,,"UgxAQek-jpZodH4OA-B4AaABAg.8mEh-CzgtLh8oF9xvsQibW","Bitchin Bob","/channel/UCR1vHH6lYZIhOyNpXVHpzRg","https://yt3.ggpht.com/a/AATXAJyMzIopkNMiuSPQqd9euZe-ZOHdszWDvXL4tA=s32-c-k-c0xffffffff-no-rj-mo","Nah, we just take of our own shit. If you did too we wouldn't have a problem.",0,"1 year ago",1553005851941,false
,,,,,,,,,,,,"UgxAQek-jpZodH4OA-B4AaABAg.8mEh-CzgtLh8oFs5AfAxPD","NotMe,","/channel/UC58hT553sreX6BKWcOfjROw","https://yt3.ggpht.com/a/AATXAJxCbPd3Kawu6SQUbiXBkJ08kY7J4qt9GaboJA=s32-c-k-c0xffffffff-no-rj-mo","@Bitchin Bob what on earth are blabbering about? You are not taking care of your own problems at all... Your president along with half of the country doesn't even believe in climate change despite if it being already in your face with all the fires, hurricanes and record heat waves. You are the only first world nation that can't take care of health needs of your own citizens and your gun violence is way out of control with nobody trying to fix anything. Lmao!",0,"1 year ago",1553005851942,false
"UgwInKKuhicXDq4uLL94AaABAg","Kamal b","/channel/UCzraj4jnwZ9BQ5P8hqaHWSA","https://yt3.ggpht.com/a/AATXAJyt59XhiQQaYcbcA-KUMM_JzYhHkZktDElLBw=s48-c-k-c0xffffffff-no-rj-mo","Best discussion ever!!",0,"1 year ago",1553005851619,false,false,,,,,,,,,,,
"Ugzg2VKLiPfSeJttztB4AaABAg","samar pandab","/channel/UCkfLwqrzGeRJp0EjfIg9Jag","https://yt3.ggpht.com/a/AATXAJyWKACQaRla5e27PXVthryP5TL5horRh1HeDg=s48-c-k-c0xffffffff-no-rj-mo","Thank u sir for the valuable topic. I am regular viewer of all your shows. They are very good , refreshing our intelligence.thank u so much",0,"1 year ago",1553005851620,false,false,,,,,,,,,,,
"UgwHhsrJ0UtIiJ0VtIZ4AaABAg","somi somi","/channel/UCTRaG1-LHl-XrJwCsCvNI4A","https://yt3.ggpht.com/a/AATXAJxm-yVWy3D1U--DOZL87jq1qCjGbZtXiw4gtw=s48-c-k-c0xffffffff-no-rj-mo","mars... m coming",0,"1 year ago",1553005851621,false,false,,,,,,,,,,,
"Ugy8xlcBFLnY3ggZNJZ4AaABAg","JaGeRmEiStEr BoMb","/channel/UCBN0zAsSwEHbRJDBARP8Mew","https://yt3.ggpht.com/a/AATXAJxod43e4aNvOxxfm8K7SRDZ0vbHRAskcNAVRA=s48-c-k-c0xffffffff-no-rj-mo","become vegan and reduce nearly 51% of GLOBAL WARMING causing gas such as co2, methane and nitrous oxide",0,"1 year ago",1553005851622,false,false,,,,,,,,,,,
"UgyxEko1iEPKVAI4lv94AaABAg","bhushan Kudale","/channel/UC29An9vFRG7D5TsZHch7tTg","https://yt3.ggpht.com/a/AATXAJxc3ArsGS7SRNgWH2jYdP99PwtXFA8BHPD5WQ=s48-c-k-c0xffffffff-no-rj-mo","I think film should be made to show the future consequences due to today's karma....",1,"1 year ago",1553005851623,false,true,"EkQSC2t5TnpLWkhLMHowwAEAyAEA4AEBogINKP___________wFAAMICGxoXaHR0cHM6Ly93d3cueW91dHViZS5jb20iABgGMk0aSxIaVWd5eEVrbzFpRVBLVkFJNGx2OTRBYUFCQWciAggAKhhVQ0lTZ25TTndxUTJpOGxoQ3VuM0t0UWcyC2t5TnpLWkhLMHowQAFICg%3D%3D",1,,,,,,,,,
,,,,,,,,,,,,"UgyxEko1iEPKVAI4lv94AaABAg.8mD6KOO0yHw8mmVajDWKTN","Koushik Worldian","/channel/UCtK1VaBGEgbzMjeYTVfUyAg","https://yt3.ggpht.com/a/AATXAJxJ2wsiufi7XnuTT0a2tYa3OxinAMPp9NbPfA=s32-c-k-c0xffffffff-no-rj-mo","bhushan Kudale but who will make it is the point",0,"1 year ago",1553005851952,false
"UgyQAejdRu0slei7Mkh4AaABAg","Rinku Singh","/channel/UC-Cv8jAyjwjo2OmLpiyqp9w","https://yt3.ggpht.com/a/AATXAJyf20pW5X0AArdHqxLk03tqHCPQvUOwof9eUQ=s48-c-k-c0xffffffff-no-rj-mo","Brazil cutting Forest, UK+ Netherlands exploring oli ,",0,"1 year ago",1553005851624,false,false,,,,,,,,,,,
"UgyyRKrOTjuKWo4AcHp4AaABAg","Amit Sahni","/channel/UCIJHIem5c4lkayMtb3hIxIA","https://yt3.ggpht.com/a/AATXAJw0hLBBYLi_kNob3sl7V1_xYp5zoz6EA1n36w=s48-c-k-c0xffffffff-no-rj-mo","please mention  sub title also",0,"1 year ago",1553005851625,false,false,,,,,,,,,,,
"UgwD61jB3xxJPHnO7k94AaABAg","thanos rulz","/channel/UCrABCs_nLsx1HJbisUMIlgQ","https://yt3.ggpht.com/a/AATXAJxdew1kl7cFix8bq-qtTQOAXmH99pLazWs_dA=s48-c-k-c0xffffffff-no-rj-mo","Prof C K ruled the floor... thanks for an awesome interaction...",0,"1 year ago",1553005851626,false,false,,,,,,,,,,,
"Ugxuler3kh-KasXGwKd4AaABAg","Khaderbee Sk","/channel/UCmUnZCri_tPYZAyTqKsB6LQ","https://yt3.ggpht.com/a/AATXAJxk2BSaeBg55g8hCxqJSDrXl94ro9Ky4vGajw=s48-c-k-c0xffffffff-no-rj-mo","Too informative im from south..our debate masters are Kathi Mahesh,sri Reddy and MAhAA murthy for any issues it may be...any debate it may be!!",0,"1 year ago",1553005851627,false,true,"EkQSC2t5TnpLWkhLMHowwAEAyAEA4AEBogINKP___________wFAAMICGxoXaHR0cHM6Ly93d3cueW91dHViZS5jb20iABgGMk0aSxIaVWd4dWxlcjNraC1LYXNYR3dLZDRBYUFCQWciAggAKhhVQ0lTZ25TTndxUTJpOGxoQ3VuM0t0UWcyC2t5TnpLWkhLMHowQAFICg%3D%3D",3,,,,,,,,,
,,,,,,,,,,,,"Ugxuler3kh-KasXGwKd4AaABAg.8mBccyAKlJD8mmW8CrKVJF","Koushik Worldian","/channel/UCtK1VaBGEgbzMjeYTVfUyAg","https://yt3.ggpht.com/a/AATXAJxJ2wsiufi7XnuTT0a2tYa3OxinAMPp9NbPfA=s32-c-k-c0xffffffff-no-rj-mo","Khaderbee Sk రే బాబు ఆపరా నీ సోది 🙏",0,"1 year ago",1553005851937,false
,,,,,,,,,,,,"Ugxuler3kh-KasXGwKd4AaABAg.8mBccyAKlJD8mmXCEU38me","Khaderbee Sk","/channel/UCmUnZCri_tPYZAyTqKsB6LQ","https://yt3.ggpht.com/a/AATXAJxk2BSaeBg55g8hCxqJSDrXl94ro9Ky4vGajw=s32-c-k-c0xffffffff-no-rj-mo","+Troller of trollers chepaliga me ghanatha",0,"1 year ago",1553005851938,false
,,,,,,,,,,,,"Ugxuler3kh-KasXGwKd4AaABAg.8mBccyAKlJD8mmYBf1oxg6","Koushik Worldian","/channel/UCtK1VaBGEgbzMjeYTVfUyAg","https://yt3.ggpht.com/a/AATXAJxJ2wsiufi7XnuTT0a2tYa3OxinAMPp9NbPfA=s32-c-k-c0xffffffff-no-rj-mo","Khaderbee Sk ఫీకినావ్ తీ. ..అడ్డమైన పేర్లు అన్ని వాగి తెలుగోడి ఇజ్జత్ తీయకు..",0,"1 year ago",1553005851939,false
"Ugy0IaFvgnd11aovKYZ4AaABAg","akshita saxena","/channel/UCdwb78UXU87fdYVslTBeOwA","https://yt3.ggpht.com/a/AATXAJwgdm44euleFd3-7ordPYvk7_0Cc2SNQ_Trxg=s48-c-k-c0xffffffff-no-rj-mo","C.K.Varshney Sir's way of explanation is awesome!",0,"1 year ago",1553005851628,false,false,,,,,,,,,,,
"UgwxDawjLOff7jpasuR4AaABAg","Deepthi M","/channel/UCL8CXaYkJRCP4zocSMe6j1Q","https://yt3.ggpht.com/a/AATXAJw6F2zTOKITSDtBoM73NYG6jR1qk--cF2DawA=s48-c-k-c0xffffffff-no-rj-mo","Good insights by Prof Varshney!",1,"1 year ago",1553005851629,false,false,,,,,,,,,,,
"UgyNLNvnYInqqhRIKoh4AaABAg","Lee Dong Min","/channel/UCQad0GsZtiFDn4KDPf47rFg","https://yt3.ggpht.com/a/AATXAJxsQq4QG0EX5ObJmpR-vWB6IyJsUJ6zFZZ2Dw=s48-c-k-c0xffffffff-no-rj-mo","C.K.V sir is amazing...\nThank you Sir",1,"1 year ago",1553005851630,false,false,,,,,,,,,,,
"UgypnhJImMHm9EIDG3Z4AaABAg","HardWarUK","/channel/UCZ3nOi7ZQtelXJHcvCps_2A","https://yt3.ggpht.com/a/AATXAJyQ1ycAgsGGAzovPRncfCPf0S7JfQI8nq37Ww=s48-c-k-c0xffffffff-no-rj-mo","I keep hearing about electric cars, but it takes 70 years for an electric car to mitigate the CO2 that was created in the building of the car!",2,"1 year ago",1553005852502,false,false,,,,,,,,,,,
"Ugxt9NZ5Cix4jEeXpkR4AaABAg","HardWarUK","/channel/UCZ3nOi7ZQtelXJHcvCps_2A","https://yt3.ggpht.com/a/AATXAJyQ1ycAgsGGAzovPRncfCPf0S7JfQI8nq37Ww=s48-c-k-c0xffffffff-no-rj-mo","1.5C by 2100? In the UK we were told we have up to 2050 to get rid of all CO2 or it will get to 2C rise by 2050!",0,"1 year ago",1553005852503,false,false,,,,,,,,,,,
"Ugwr9APoNszeVDEpStN4AaABAg","Aasaan Hain","/channel/UCNFP-mY-Iowox1akMelVa7w","https://yt3.ggpht.com/a/AATXAJyfzkfyL7-cvN4Brec-c4Nqn5wHiztX58SNtw=s48-c-k-c0xffffffff-no-rj-mo","please if anyone can than pls provide summary in comment section plss🙏🙏🙏",1,"1 year ago",1553005852504,false,true,"EkQSC2t5TnpLWkhLMHowwAEAyAEA4AEBogINKP___________wFAAMICGxoXaHR0cHM6Ly93d3cueW91dHViZS5jb20iABgGMk0aSxIaVWd3cjlBUG9Oc3plVkRFcFN0TjRBYUFCQWciAggAKhhVQ0lTZ25TTndxUTJpOGxoQ3VuM0t0UWcyC2t5TnpLWkhLMHowQAFICg%3D%3D",2,,,,,,,,,
,,,,,,,,,,,,"Ugwr9APoNszeVDEpStN4AaABAg.8mAnPBB6Ouf8mJAbyExVpe","Chandrashekhar Chauhan","/channel/UC8TMs1BWPeL5KOwDpfimpMg","https://yt3.ggpht.com/a/AATXAJz_30BWtcNFuhXts4x2oGb_1xM_F6NNLKmE9A=s32-c-k-c0xffffffff-no-rj-mo","Try to listen and make your own summary.. You will realize that you have made better summary than other's readymade fodder.. Try once",2,"1 year ago",1553005852819,false
,,,,,,,,,,,,"Ugwr9APoNszeVDEpStN4AaABAg.8mAnPBB6Ouf8mmVmoDj7Bi","Koushik Worldian","/channel/UCtK1VaBGEgbzMjeYTVfUyAg","https://yt3.ggpht.com/a/AATXAJxJ2wsiufi7XnuTT0a2tYa3OxinAMPp9NbPfA=s32-c-k-c0xffffffff-no-rj-mo","Chandrashekhar Chauhan FunTeaStick👏👏",1,"1 year ago",1553005852819,true
"UgxDKBybMm0BATqlQWh4AaABAg","ramesh kumar","/channel/UCdLpsRjjHHmSsa57bkn1PEg","https://yt3.ggpht.com/a/AATXAJywbSkw38UJ7Se9gkq_THdT6WAG54sinMWvsQ=s48-c-k-c0xffffffff-no-rj-mo","Everyone is just talking, this can be done that can be done, I expect to do something from others for climate but not from myself, we will wear coat in summer season unnecessarily and sit down in AC RSTV studio and let temperature be very cool which will consume more electricity then we will discuss how others should do something for saving environment. Good job",21,"1 year ago",1553005852505,false,false,,,,,,,,,,,
"UgwFYdowJxb5DGlYkM14AaABAg","harsha","/channel/UCdgLo07n-XrxW7uZFV4O1-g","https://yt3.ggpht.com/a/AATXAJyy44SVdK1IMZbm0fYP3lv2xB3oD_WMuiU8mg=s48-c-k-c0xffffffff-no-rj-mo","Last alarming bell to the world ...\nWaiting for such words...\nScience and politics!\n5 things from report\n1.excessive investments \n2.energy transaction from carbon to renewable\n3.Electricn transportation\n4.innovation reserach\n5.people participation",6,"1 year ago",1553005852508,true,false,,,,,,,,,,,
"UgyxoHn4sYEuMnPp_GV4AaABAg","neelesh kushwaha","/channel/UCc5SWDopRkgKLUKiq4e0pAA","https://yt3.ggpht.com/a/AATXAJwMgXZpm5lvjZyn1rtyoYsf9l6LZc-zMiWcOA=s48-c-k-c0xffffffff-no-rj-mo","Plz add cc",0,"1 year ago",1553005852510,false,false,,,,,,,,,,,
"UgxthayoZhRqTheUbx94AaABAg","PRATEEKSHA SINGH","/channel/UCrwgl1_HJwLbZLF7qNXYLGw","https://yt3.ggpht.com/a/AATXAJyJxxnb1p0OYVhYG8w_qANMkKZOvhKqzB648A=s48-c-k-c0xffffffff-no-rj-mo","One of reasons I watch #Bigpicture regularly is Mr Frank Pereira😄. \nHere Prof. steals the show👍very clear and to the point.",8,"1 year ago",1553005852512,false,false,,,,,,,,,,,
"UgzBk925-d0ojsvuPvR4AaABAg","Rahul Omble","/channel/UCzRUBlUrAVpnKk1mVf_TMag","https://yt3.ggpht.com/a/AATXAJzYs6_Cnhh-TiMr90ZxauRvzuUAqbEu4GD6Rw=s48-c-k-c0xffffffff-no-rj-mo","I have one question ,did all this respected people's came in fossil fuels free vehicle or not?🙏",1,"1 year ago",1553005852513,false,true,"EkQSC2t5TnpLWkhLMHowwAEAyAEA4AEBogINKP___________wFAAMICGxoXaHR0cHM6Ly93d3cueW91dHViZS5jb20iABgGMk0aSxIaVWd6Qms5MjUtZDBvanN2dVB2UjRBYUFCQWciAggAKhhVQ0lTZ25TTndxUTJpOGxoQ3VuM0t0UWcyC2t5TnpLWkhLMHowQAFICg%3D%3D",3,,,,,,,,,
,,,,,,,,,,,,"UgzBk925-d0ojsvuPvR4AaABAg.8mAE9i9W-ib8mAMD7rbCg4","Satish Mishra","/channel/UCKeEZzMsFhFtGVd9IFtgT8w","https://yt3.ggpht.com/a/AATXAJzqXPeHOLiRWspnWEAC1ThM9p9LPv2mSAFAFw=s32-c-k-c0xffffffff-no-rj-mo","lol",0,"1 year ago",1553005852834,false
