"id","author","authorLink","authorThumb","text","likes","time","timestamp","edited","hasReplies","repliesToken","numReplies","reply.id","reply.author","reply.authorLink","reply.authorThumb","reply.text","reply.likes","reply.time","reply.timestamp","reply.edited"
,,,,,,,,,,,,"UgxdS9_2qxrM2nTCuZF4AaABAg.8kYHBzrSPZN8xN7unRX2o2","Sekhar Thangirala","/channel/UCf7aFLBUWwps4OqGghnvY-g","https://yt3.ggpht.com/a/AATXAJw2SflzPnQkOUOrn0kqfOObMxaJCABvkPMS5w=s32-c-k-c0xffffffff-no-rj-mo","Sonam Chandani , You can increase height through Naturopathy if you are under 18. Boys should be under 19. These are Western measures I am quoting. Dr. Manthrna Satyanarayana Raju got his height increased by 4” by a 3 months stay at a Naturopathy aasram. He is a famous and selfless spreader of Naturopathy now, having a 600 bedded Wellness Centre on banks of Krishna river in Vijayawada. You may google Arogyalayam or the doctor’s name for more info on the aasram",0,"8 months ago",1563548784119,false
,,,,,,,,,,,,"UgxdS9_2qxrM2nTCuZF4AaABAg.8kYHBzrSPZN8yRq3zdUrmC","Suresh","/channel/UCsTQyQbkPtn-W8KAAbq_ZDA","https://yt3.ggpht.com/a/AATXAJy1ox0pEBVSUcMF4_ReR-BwyTEtaUdb3Qef=s32-c-k-c0xffffffff-no-rj-mo","Assume it is impossible at your age. Forget about height. Instead, work on cultivating a pleasing personality.",0,"7 months ago",1566227184120,false
"UgzT3V29RYGGpQGvth14AaABAg","rohit saini","/channel/UCTzUe4n9H6ERc4Ngyrp7pIA","https://yt3.ggpht.com/a/AATXAJz_3Irxbz0nV5Uv8IhKP5hWX4dQBS7EVTX5nw=s48-c-k-c0xffffffff-no-rj-mo","great talk , especially when he explained health is enthusiasm to work or passion futhermore body is only perception of mind",4,"1 year ago",1553007983819,false,false,,,,,,,,,,,
"Ugz_bX9E4yPVypPzxp54AaABAg","Bala Ganesh","/channel/UCixLiqqw58yybfsfJ_caZ1g","https://yt3.ggpht.com/a/AATXAJxA70hwx2GWmcP8QsudLMIGuEEaCDjKeU2Jhg=s48-c-k-c0xffffffff-no-rj-mo","Namasthe sir,  I am balaganesh, guest Faculty in Andhra university music and dance department, sir brother suffering with tongue cancer, doctors said he is final. He is no life. Please guide me how can save my brother?",0,"1 year ago",1553007983820,false,true,"EkQSC0stbWdtSWphUmxZwAEAyAEA4AEBogINKP___________wFAAMICGxoXaHR0cHM6Ly93d3cueW91dHViZS5jb20iABgGMk0aSxIaVWd6X2JYOUU0eVBWeXBQenhwNTRBYUFCQWciAggAKhhVQ3NUMFlJcXducEpDTS1teDctZ1NBNFEyC0stbWdtSWphUmxZQAFICg%3D%3D",2,,,,,,,,,
,,,,,,,,,,,,"Ugz_bX9E4yPVypPzxp54AaABAg.8is9R-sYf2D8s0QrSzM9-E","prasad hiremath","/channel/UCLx2lKHZaMz-Dg0Jzkyt3eQ","https://yt3.ggpht.com/a/AATXAJzKGUKynu-t8UL9oLwBpRyypcAXyBpaApcq5w=s32-c-k-c0xffffffff-no-rj-mo","U can take sidda medicine call to this no immediately",0,"1 year ago",1553007984175,false
,,,,,,,,,,,,"Ugz_bX9E4yPVypPzxp54AaABAg.8is9R-sYf2D8s0R0JLld4M","prasad hiremath","/channel/UCLx2lKHZaMz-Dg0Jzkyt3eQ","https://yt3.ggpht.com/a/AATXAJzKGUKynu-t8UL9oLwBpRyypcAXyBpaApcq5w=s32-c-k-c0xffffffff-no-rj-mo","Pratap Singh Sidda Pandit 9652784840",0,"1 year ago",1553007984175,false
"UgyqXzqt8y8zeUX4dyV4AaABAg","Raja Jagati","/channel/UCm15U5t3fztqLPGcji2Ds6Q","https://yt3.ggpht.com/a/AATXAJzytFPMcOKnMBLcRqZ6iblGusUgGzABQ126Eg=s48-c-k-c0xffffffff-no-rj-mo","Hindu zakir naik",4,"1 year ago",1553007983821,false,false,,,,,,,,,,,
"UgxBcQpg0CxrC6p8zPF4AaABAg","karthikeyan M","/channel/UCwUsiCaekbN5NU-lk0qWfxg","https://yt3.ggpht.com/a/AATXAJxAtUC0tl0MulsL1sKkiUA0uqKp4g6-36WA_g=s48-c-k-c0xffffffff-no-rj-mo","speech is good but most of them repeating 85%",1,"1 year ago",1553007983822,false,true,"EkQSC0stbWdtSWphUmxZwAEAyAEA4AEBogINKP___________wFAAMICGxoXaHR0cHM6Ly93d3cueW91dHViZS5jb20iABgGMk0aSxIaVWd4QmNRcGcwQ3hyQzZwOHpQRjRBYUFCQWciAggAKhhVQ3NUMFlJcXducEpDTS1teDctZ1NBNFEyC0stbWdtSWphUmxZQAFICg%3D%3D",1,,,,,,,,,
,,,,,,,,,,,,"UgxBcQpg0CxrC6p8zPF4AaABAg.8ibXXF4cH7T966FRv-Sxcz","Manjunath Bendigeri","/channel/UCrfUeeJvGKGbHej_CjWDkyA","https://yt3.ggpht.com/a/AATXAJxnUhQU91Kcn0bLBG4zUi9NFF5oWYvTVthCoA=s32-c-k-c0xffffffff-no-rj-mo","Audience are different and also the place",1,"1 week ago",1584025584136,false
"UgxHsIfC5Y5BZkeLvHN4AaABAg","Simren","/channel/UCBe2ZUj4QrhI8bTPdqi9T-A","https://yt3.ggpht.com/a/AATXAJwgfMx6zz_nHEjTy3uVyaQG1eB16K_AIj5FCA=s48-c-k-c0xffffffff-no-rj-mo","He is 100% on point. The point at which he said you are not your parents lifted a huge worry from my mind. Despite believing I am on my own journey, my parent's health history has been a huge weight on my shoulders and I am grateful to find someone who spoke out loud affirming what I have always known and prescribe to. A healthy mind creates a healthy body. Thank you for sharing this.",0,"1 year ago",1553007983823,false,false,,,,,,,,,,,
"UgzprQ2nw7NXAVvq_5J4AaABAg","S C","/channel/UCp05LXPZCRYi9m376rrWB5Q","https://yt3.ggpht.com/a/AATXAJwdac7Yshd7oKjpeU8RaGTp84LZAFqZ8tXMGA=s48-c-k-c0xffffffff-no-rj-mo","Genuine dr🙏🏼",7,"1 year ago",1553007983824,false,false,,,,,,,,,,,
"UgwmrCNOqfa2JNPJDqR4AaABAg","Indus TV","/channel/UC4E0sqxpaRjucW5J2HB71Eg","https://yt3.ggpht.com/a/AATXAJxHK-FgzbsoDeA-qevPBTF0XAYbMZjQf2y3jQ=s48-c-k-c0xffffffff-no-rj-mo","Didn't know Gandhi did TED talks",0,"1 year ago",1553007983824,false,false,,,,,,,,,,,
"Ugx-4Rjunnum_mp_lWh4AaABAg","Vanitha Praveen","/channel/UCVi6-9tiqMLCfdcB3XvNSTA","https://yt3.ggpht.com/a/AATXAJy8SdXf8HPXr1fK0uM-CC399xyOob5ul65O=s48-c-k-c0xffffffff-no-rj-mo","Impressive sir",0,"1 year ago",1553007983825,false,false,,,,,,,,,,,
"UgzyJOHi2-dnV1Ff8Ht4AaABAg","Noothan S","/channel/UChVarRKXrAM-Pdc3ntghqRg","https://yt3.ggpht.com/a/AATXAJzUl6eWn-YzxDDdrs4O804JAwI8nFuwBzJw3Q=s48-c-k-c0xffffffff-no-rj-mo","Dr. B M Hegde, you are amazing for speaking the truth! 🙏🏼",7,"1 year ago",1553007983826,false,true,"EkQSC0stbWdtSWphUmxZwAEAyAEA4AEBogINKP___________wFAAMICGxoXaHR0cHM6Ly93d3cueW91dHViZS5jb20iABgGMk0aSxIaVWd6eUpPSGkyLWRuVjFGZjhIdDRBYUFCQWciAggAKhhVQ3NUMFlJcXducEpDTS1teDctZ1NBNFEyC0stbWdtSWphUmxZQAFICg%3D%3D",1,,,,,,,,,
,,,,,,,,,,,,"UgzyJOHi2-dnV1Ff8Ht4AaABAg.8foyX8PyiQM90wE9fGRHco","any r","/channel/UCiMwfP23cOD1G2SPHxY-VFQ","https://yt3.ggpht.com/a/AATXAJwZjwePMAGzdDcmfFEEBqvBdvsmIKwvG3vEOA=s32-c-k-c0xffffffff-no-rj-mo","Physicist Brian Cox argues that misuse of the word ""quantum"", such as its use in the phrase quantum healing, has a negative effect on society as it undermines genuine science and discourages people from engaging with conventional medicine. He states that ""for some scientists, the unfortunate distortion and misappropriation of scientific ideas that often accompanies their integration into popular culture is an unacceptable price to pay.""[7]",0,"4 months ago",1574175984108,false
"UgxPvIVpKF_h3Io2CrJ4AaABAg","Madhavi NC","/channel/UC4Qx2lxGX2gyJ3LaSrZfq1Q","https://yt3.ggpht.com/a/AATXAJwNJcS3M9knfALKGAf3NwzygcmS_6GVWTqv-Q=s48-c-k-c0xffffffff-no-rj-mo","Enlightening",1,"1 year ago",1553007983827,false,false,,,,,,,,,,,
"Ugxqd-Kz-ym6KztRq5h4AaABAg","priya ravindran","/channel/UCxzYyHbZUYFub7g4vK6bByw","https://yt3.ggpht.com/a/AATXAJzhJsRPo-_NYGspC6a5IJqsv3QomSPeydJj2Q=s48-c-k-c0xffffffff-no-rj-mo","Impressive speech!! Superb..",2,"1 year ago",1553007983828,false,false,,,,,,,,,,,
"Ugx5rgaJ-9REO8q7LLp4AaABAg","J Ramanathan","/channel/UCHtJKWZWEz-KQCedLKa5EcA","https://yt3.ggpht.com/a/AATXAJwRUAbjOBsCtuUgUbiYoSyXKMYdQLMaKG57=s48-c-k-c0xffffffff-no-rj-mo","Thank you Dr Hedge.",0,"2 years ago",1521471983828,false,false,,,,,,,,,,,
"UgxvT5mTekJF5Ya_E0N4AaABAg","YouvYou love sports","/channel/UCxeYJ_idgB0_KHRFG6VcmYw","https://yt3.ggpht.com/a/AATXAJy41guGhbt8uF1nUl_tbg5sRvtM-fZBPtGS7g=s48-c-k-c0xffffffff-no-rj-mo","Sir you are the best",0,"2 years ago",1521471983829,false,false,,,,,,,,,,,
"UgwHOUtewf47jaookZ14AaABAg","Medicos for you","/channel/UCBFiGKcAL7itnvfW6HPFF-Q","https://yt3.ggpht.com/a/AATXAJw82rtz79c0cGkKIHyH64vFsECRlKfnvwoc=s48-c-k-c0xffffffff-no-rj-mo","Excellent sir",0,"2 years ago",1521471983830,false,false,,,,,,,,,,,
"UgxX2NfmRxxKCA8uuON4AaABAg","PARUL SHAH","/channel/UCnf7j8jvZdKm4e_xSQD7D9g","https://yt3.ggpht.com/a/AATXAJwvD757lvJtq1r3DhSl7de7AGGHN149pa20YQ=s48-c-k-c0xffffffff-no-rj-mo","A Blessed SOUL to Bless Society at large.  GOD BLESS YOU.🌻 💎 🙏",2,"2 years ago",1521471984693,false,false,,,,,,,,,,,
"UgyScBBDMHNAznibjXp4AaABAg","Aniza Ahmad","/channel/UC1WUXFWbovcnKyhRdNYxoHA","https://yt3.ggpht.com/a/AATXAJzo5jdz0C0SYwEIcmtVyG1dfmbain-WCqrykQ=s48-c-k-c0xffffffff-no-rj-mo","Mind your mind👍👍👍",2,"2 years ago",1521471984694,false,false,,,,,,,,,,,
"Ugzc4uQV-t4IrIdcrF54AaABAg","Beast Master","/channel/UCs1kcPnD00uJXfbM3C7hzxA","https://yt3.ggpht.com/a/AATXAJwETA_0od_nR-ikAvL7q81rorG3G3e1ILVnLg=s48-c-k-c0xffffffff-no-rj-mo","☝👌👍",0,"2 years ago",1521471984695,false,false,,,,,,,,,,,
"Ugyvsl8_bC-rCgVJ2q94AaABAg","Shanti Ayurveda","/channel/UCTON7sFM85aR_kdCL65jqyA","https://yt3.ggpht.com/a/AATXAJw6nRYLEOYCN_0M7vYFh2HkVyPuRHpIVL7T3g=s48-c-k-c0xffffffff-no-rj-mo","Great !!!!",0,"2 years ago",1521471984695,false,false,,,,,,,,,,,
"UgzBjxlWXZh1mBKGaA94AaABAg","Harsha P","/channel/UCsOz1L-8Rc6u4aFmxIziMog","https://yt3.ggpht.com/a/AATXAJwrhOj3lwtpFqK_PS0DPOrBPJCh2KM1KjXZCg=s48-c-k-c0xffffffff-no-rj-mo","I wish this doctor makes more videos :)",3,"2 years ago",1521471984696,false,true,"EkQSC0stbWdtSWphUmxZwAEAyAEA4AEBogINKP___________wFAAMICGxoXaHR0cHM6Ly93d3cueW91dHViZS5jb20iABgGMk0aSxIaVWd6Qmp4bFdYWmgxbUJLR2FBOTRBYUFCQWciAggAKhhVQ3NUMFlJcXducEpDTS1teDctZ1NBNFEyC0stbWdtSWphUmxZQAFICg%3D%3D",1,,,,,,,,,
,,,,,,,,,,,,"UgzBjxlWXZh1mBKGaA94AaABAg.8_f4VUnomGp9-QpclY3qnz","Sunil Kotha","/channel/UC3S_8BuKuWw4oRhE1m3Lw8A","https://yt3.ggpht.com/a/AATXAJxdgBGkC4ZrzD39bvWgg2FOsvkfJU30dg7zYw=s32-c-k-c0xffffffff-no-rj-mo","Lot of videos available in youtube!",0,"5 months ago",1571497585016,false
"UgzFTF3pfd_lKtO0qIB4AaABAg","Pannir Pannir","/channel/UC24WydiL_vakUSWo9k_TjyQ","https://yt3.ggpht.com/a/AATXAJwzm0fnhiW8pFfbpx6lbH8uZH8VnrKkPM0SQg=s48-c-k-c0xffffffff-no-rj-mo","Great Speech",0,"2 years ago",1521471984698,false,false,,,,,,,,,,,
"UgxlYve3xYkC0QXkGOd4AaABAg","Raja Ramalingam","/channel/UCJ9x-j5adCQ070jClIA3QRQ","https://yt3.ggpht.com/a/AATXAJy4lGni6nlyLmmo7a9Kj-HG_D3PIx6gzwYCYQ=s48-c-k-c0xffffffff-no-rj-mo","True speech",0,"2 years ago",1521471984698,false,false,,,,,,,,,,,
"UgyxScQVhBYA0kfstRV4AaABAg","Ganesh kumar muniyandi","/channel/UCMVe1iFgT7ZYRj19S2_rfLw","https://yt3.ggpht.com/a/AATXAJzUZznYrxxlhDcWR_vbD_elhayWt7auNi8gRw=s48-c-k-c0xffffffff-no-rj-mo","Superb...",0,"2 years ago",1521471984699,false,false,,,,,,,,,,,
"UgihPg0GaTCuL3gCoAEC","Manisha Phadke","/channel/UC43tNkW7w3UjQTENNVPouBg","https://yt3.ggpht.com/a/AATXAJzIUu3Vxhtbhrqc4hE4--5k8tjcis1RS2DmwA=s48-c-k-c0xffffffff-no-rj-mo","Excellent talk by Dr.Hegde!",0,"2 years ago",1521471984700,false,false,,,,,,,,,,,
"UgxSnUDeVBiJktMlJLZ4AaABAg","KANCHAN JALEES","/channel/UCSGMxrn3IaHTO7Byw8Sgujw","https://yt3.ggpht.com/a/AATXAJzQ_BWm31a6pgSlHBZ7UZlk66oPTznB8DnUBw=s48-c-k-c0xffffffff-no-rj-mo","nice video",1,"2 years ago",1521471984700,false,false,,,,,,,,,,,
"UgyIv6Qe1LMoGyKammN4AaABAg","Selvaraj Muthiah","/channel/UCfUNB-ZnBHO-sXOr0Tz7eJQ","https://yt3.ggpht.com/a/AATXAJxQUNblNwrUisxW0SK-qobesazktNrxrW899Q=s48-c-k-c0xffffffff-no-rj-mo","Wonderful! EGW thought is affirmed",2,"2 years ago",1521471984701,false,false,,,,,,,,,,,
"UgwoI0Iz1I103hJNY8p4AaABAg","Rajesh P","/channel/UCxIVX3MOPCligJrg8NSy8nQ","https://yt3.ggpht.com/a/AATXAJzSTIDnk72VrGLVf9_7kUmjNw-VgIlorO563Q=s48-c-k-c0xffffffff-no-rj-mo","Sir Thank u very much",1,"2 years ago",1521471984702,false,false,,,,,,,,,,,
"UgzLPdhLguHbQVVePB14AaABAg","prla mo","/channel/UChmqLaQOj7urdMYdXO3twDw","https://yt3.ggpht.com/a/AATXAJxgK8CWoY8AglYO5o5IC4ePxFownrzFbdKWRQ=s48-c-k-c0xffffffff-no-rj-mo","i love this man",2,"2 years ago",1521471984702,false,false,,,,,,,,,,,
"UgyjwfF8-ACMLpzN03h4AaABAg","guruprasad burada","/channel/UC72sQXe07giNIS_Gf8T2rkw","https://yt3.ggpht.com/a/AATXAJyupNbjh6n1HTVsJW8IYssgBft59pzsePiIuA=s48-c-k-c0xffffffff-no-rj-mo","believe in health you will be healthy.great creative doctor",1,"2 years ago",1521471984703,false,false,,,,,,,,,,,
"UgwHXCYwPBMk0Pa_QFN4AaABAg","NATARAJ P","/channel/UCRHOzwaMKtZpGyXuyjjK7OQ","https://yt3.ggpht.com/a/AATXAJzvgnKZGR268EcnFKv18NQLrguGtkqgTBHW5A=s48-c-k-c0xffffffff-no-rj-mo","Great preacher of 'HUMANISM' & each on of us should really give a look.",2,"2 years ago",1521471984704,false,false,,,,,,,,,,,
"UgwTrBKFBKqxuq0BDiV4AaABAg","Keshav Nimbalker","/channel/UCAjBcEbLGYNcWpTWmDfbfZg","https://yt3.ggpht.com/a/AATXAJyWnjly_YK7gbdk8Mbhlp6NH_TNtqevTbHvtg=s48-c-k-c0xffffffff-no-rj-mo","This professor repeats himself ad nauseum.Please watch another  lecture-video........same   \nquotations,same jokes.After few minutes you will switch off.Some of his assertions are out- landish.The claims made can equally be  asked to be proved as  he demands of western medicine.Follow him at your peril.",7,"2 years ago",1521471984704,true,true,"EkQSC0stbWdtSWphUmxZwAEAyAEA4AEBogINKP___________wFAAMICGxoXaHR0cHM6Ly93d3cueW91dHViZS5jb20iABgGMk0aSxIaVWd3VHJCS0ZCS3F4dXEwQkRpVjRBYUFCQWciAggAKhhVQ3NUMFlJcXducEpDTS1teDctZ1NBNFEyC0stbWdtSWphUmxZQAFICg%3D%3D",4,,,,,,,,,
,,,,,,,,,,,,"UgwTrBKFBKqxuq0BDiV4AaABAg.8WtZyRCJi158ZfAkBivriR","Creamkan Ban","/channel/UC_uT4Wq-vUEDvFlBqZpcu3Q","https://yt3.ggpht.com/a/AATXAJxvHobxvBla2-eEssbpwQ8ZSRDlHiBoo1jK5A=s32-c-k-c0xffffffff-no-rj-mo","I think he is trying to convey certain basic/core/important things, he keeps repeating those (I think he himself knows that!) As those are the key things people should understand, he is trying to make sure that it gets attached to the minds of people like shloka/poem and people should start getting benefited from that. It is surprising that you are not fed up of the notorious repeated advertisements of corporate products but are restless about such noble speech!",8,"2 years ago",1521471985111,false
,,,,,,,,,,,,"UgwTrBKFBKqxuq0BDiV4AaABAg.8WtZyRCJi158_s9yLK-gMT","ashish sharma","/channel/UC8pmwOlKoUCQQH-WH5YDXdw","https://yt3.ggpht.com/a/AATXAJzDr6lmuZgTvbFciRfKdlsF8C3MAaGG3n0z4Q=s32-c-k-c0xffffffff-no-rj-mo","Dear sir , \n            Truth is truth.does'nt matter how much times you told to the people .this man is almost 80 years old and how energetic he is.",7,"2 years ago",1521471985114,false
,,,,,,,,,,,,"UgwTrBKFBKqxuq0BDiV4AaABAg.8WtZyRCJi158_sA5uTaiDE","ashish sharma","/channel/UC8pmwOlKoUCQQH-WH5YDXdw","https://yt3.ggpht.com/a/AATXAJzDr6lmuZgTvbFciRfKdlsF8C3MAaGG3n0z4Q=s32-c-k-c0xffffffff-no-rj-mo","Creamkan Ban \n100% Right boss",0,"2 years ago",1521471985116,false
,,,,,,,,,,,,"UgwTrBKFBKqxuq0BDiV4AaABAg.8WtZyRCJi158xN8C2P3MSL","Sekhar Thangirala","/channel/UCf7aFLBUWwps4OqGghnvY-g","https://yt3.ggpht.com/a/AATXAJw2SflzPnQkOUOrn0kqfOObMxaJCABvkPMS5w=s32-c-k-c0xffffffff-no-rj-mo","He is a Padma Shri awardee too, a cardiologist by profession, once VC of Manipal University",1,"8 months ago",1563548785118,false
"UgzGZH302C1Cfk0Lt594AaABAg","Raja Mohamed Kassim","/channel/UCXgA6A89FPNTbLUDoigbIPA","https://yt3.ggpht.com/a/AATXAJzEGYixGP90FTYNL07p7ufafR0adgoAnlcTZQ=s48-c-k-c0xffffffff-no-rj-mo","Great speech and great explanation, thank you Sir...🙏",3,"2 years ago",1521471984705,false,false,,,,,,,,,,,
"Ugx0BtkeHFurSxGEYEV4AaABAg","Gadrri","/channel/UCmnqzKR7oVnhckNbpYg7ADg","https://yt3.ggpht.com/a/AATXAJw0ZEVxxhNODN9B2wiHDaUYX8zquADQfhv-og=s48-c-k-c0xffffffff-no-rj-mo","did anyone find the article ""matter is not made out of matter""?",1,"2 years ago",1521471984706,false,true,"EkQSC0stbWdtSWphUmxZwAEAyAEA4AEBogINKP___________wFAAMICGxoXaHR0cHM6Ly93d3cueW91dHViZS5jb20iABgGMk0aSxIaVWd4MEJ0a2VIRnVyU3hHRVlFVjRBYUFCQWciAggAKhhVQ3NUMFlJcXducEpDTS1teDctZ1NBNFEyC0stbWdtSWphUmxZQAFICg%3D%3D",1,,,,,,,,,
,,,,,,,,,,,,"Ugx0BtkeHFurSxGEYEV4AaABAg.8Wa0mFRyiZk93Ue8JzaADR","Kalyankrishnan Palghat","/channel/UCMrjjdq1fK4XxMmsCxrWF8w","https://yt3.ggpht.com/a/AATXAJzwvDxXpWj1BKo65DrEwcsj2jDuYmbcjng4uQ=s32-c-k-c0xffffffff-no-rj-mo","Please read the book - THE NATURE OF THE PHYSICAL WORLD by Arthur Eddington",0,"2 months ago",1579446385014,false
"UgwfIIodPjMVwnfTsLB4AaABAg","PABITRA PARIJA","/channel/UCl90ICfJb_9QlrHA6iadEzA","https://yt3.ggpht.com/a/AATXAJyAq9LlS6nffpDzGRLEd5LBuHoxvJ9hzDs_zw=s48-c-k-c0xffffffff-no-rj-mo","excellent thought",0,"2 years ago",1521471984707,false,false,,,,,,,,,,,
"Ugy_pq-lyu4z9pwZAyF4AaABAg","shiva shankar","/channel/UCsaxkCAyBIGcmkwywyGTPwQ","https://yt3.ggpht.com/a/AATXAJxyJnITn1f6B90VfBKigJ4ta7N_8aMBdXcaBA=s48-c-k-c0xffffffff-no-rj-mo","honest knowledge sharing for the benefit of human race that has been trapped in the western ideology.",4,"2 years ago",1521471984708,false,false,,,,,,,,,,,
"UgwamY75VpWOmiYVjaN4AaABAg","Abilash V B","/channel/UChbAI3dj5NvXbutBloVLaXQ","https://yt3.ggpht.com/a/AATXAJyTjP2IjakHzQkzWM1OL_QQpWHtEoH7z_V1iw=s48-c-k-c0xffffffff-no-rj-mo","Hands of to Hegde Sir...",0,"2 years ago",1521471985718,true,false,,,,,,,,,,,
"UgxrgsoKzati7oO5fpp4AaABAg","Arkalgud Narayana Murthy Shashidhara","/channel/UCAsfP-6QFZH2laFR9JGqe9w","https://yt3.ggpht.com/a/AATXAJyQzAEtEomAWKRyVA1wOlp1Z9Qz7dZnQfl_Xg=s48-c-k-c0xffffffff-no-rj-mo","excellemt lecture",0,"2 years ago",1521471985720,false,false,,,,,,,,,,,
"UgzAPQI7Qdpt2H0Qqht4AaABAg","km kumarr","/channel/UCQEGucJDDCAmzOcRz78XprA","https://yt3.ggpht.com/a/AATXAJyPKKgRUabRSMFG_pRUsLvYaD9un8hfusuLjg=s48-c-k-c0xffffffff-no-rj-mo","Parnam Sir,",0,"2 years ago",1521471985720,false,false,,,,,,,,,,,
"Ugh12_NcUIMYj3gCoAEC","PRAKASH CHAND","/channel/UCjSxjA7yg2eQX-oRf3ucctw","https://yt3.ggpht.com/a/AATXAJw-iGDwlVD1kENZy8v7vYstzUVJUfDh2fzwAg=s48-c-k-c0xffffffff-no-rj-mo","He is a real doctor in medical profession.",3,"2 years ago",1521471985721,false,false,,,,,,,,,,,
"Ugg8oe5UxKfuaHgCoAEC","Saurabh Limaye","/channel/UCpzZgqAZ5ihXFxcOsGC_Mig","https://yt3.ggpht.com/a/AATXAJyd3DlJlXbMxGGbdEFwNL7QnGBi1cqFKHDndQ=s48-c-k-c0xffffffff-no-rj-mo","Sir,your every speech is inspiring n motivating towards ayurveda!!thanx a lot sir!!!",6,"2 years ago",1521471985722,false,false,,,,,,,,,,,
"UgiNpovalXCQZngCoAEC","Macaq","/channel/UCjso-FyTv6MslShIOBgLFxA","https://yt3.ggpht.com/a/AATXAJyv0rgBh0oatZw9WvX49VGJyYoVW3H7Q0dvwA=s48-c-k-c0xffffffff-no-rj-mo","14:40 hegde word's of insight",2,"2 years ago",1521471985723,false,false,,,,,,,,,,,
"Ugja3NgHTlzZ-3gCoAEC","jagadeesh d","/channel/UCvmfigLGG9kmgHJe1oUhl8A","https://yt3.ggpht.com/a/AATXAJwqQ09Rf1CgyQ4GUGgLQck5ZGBUR1ZOp6Dylg=s48-c-k-c0xffffffff-no-rj-mo","thank you sir.. wonderful speech",1,"2 years ago",1521471985723,false,false,,,,,,,,,,,
"UgjsvKU4Kgo5VHgCoAEC","Vinod Gandhi","/channel/UCCiRhkgs79mFAn9K4yz0y1w","https://yt3.ggpht.com/a/AATXAJyOiO7CJmlev8zrWOsk-jWBE17aMcYSXIyLYA=s48-c-k-c0xffffffff-no-rj-mo","“The word health comes from the word whole. When your body, your mind, your emotion, your energies are in tune with each other and you feel wholesome within yourself, that is when you feel healthy.”\n\nhttp://isha.sadhguru.org/blog/lifestyle/health-fitness/living-healthy-and-well/",0,"2 years ago",1521471985724,false,false,,,,,,,,,,,
"Ugg0kS4ABZqsUXgCoAEC","Milind Gautam","/channel/UCyVL_7V8nzLDUEd2aS8Sfxg","https://yt3.ggpht.com/a/AATXAJyJ6sBITQ3WYGPND9K1dRAS_XtR0sQ2Y6H8Lg=s48-c-k-c0xffffffff-no-rj-mo","Enlightening to hear him.🙏Thanks for sharing. ☺",1,"2 years ago",1521471985725,false,false,,,,,,,,,,,
"UghuKPTL7kgmNngCoAEC","kavitha sengu","/channel/UC2T8piluoW3V0EHfJ91IAJA","https://yt3.ggpht.com/a/AATXAJxay6jtabs45Ps_gMcF0Yp6e3DdFePfHAkEQg=s48-c-k-c0xffffffff-no-rj-mo","what he is saying is so practical. i too felt it.he is 100%correct.i don't know how he made such a research. i am sharing it to so many group.for the benefit of mankind",37,"2 years ago",1521471985725,false,true,"EkQSC0stbWdtSWphUmxZwAEAyAEA4AEBogINKP___________wFAAMICGxoXaHR0cHM6Ly93d3cueW91dHViZS5jb20iABgGMkcaRRIUVWdodUtQVEw3a2dtTm5nQ29BRUMiAggAKhhVQ3NUMFlJcXducEpDTS1teDctZ1NBNFEyC0stbWdtSWphUmxZQAFICg%3D%3D",4,,,,,,,,,
,,,,,,,,,,,,"UghuKPTL7kgmNngCoAEC.8VJmRDEky4l8WWgwaamJTe","Kant Mani","/channel/UCrpLRJdf5cFy3xwitcssBPQ","https://yt3.ggpht.com/a/AATXAJwVnk_jHeat1H7digHik69T7_b6bm6KE9mXcQ=s32-c-k-c0xffffffff-no-rj-mo","no doubt you're following him practically. this shows your compassion for others. you got the message. thanks...",3,"2 years ago",1521471986024,false
,,,,,,,,,,,,"UghuKPTL7kgmNngCoAEC.8VJmRDEky4l8mvnfSYjroT","Luvanon","/channel/UC_03aJR-U6AneAbO-Nw8Ivg","https://yt3.ggpht.com/a/AATXAJzVRfc7ii-GtQEbNN3yLyfnMtovvqobafTJUA=s32-c-k-c0xffffffff-no-rj-mo","For the benefit of humanity.",1,"1 year ago",1553007986025,false
,,,,,,,,,,,,"UghuKPTL7kgmNngCoAEC.8VJmRDEky4l8sXU4KnNAJu","bhasilej","/channel/UC1TNIphTMVbTyJE9qfafblw","https://yt3.ggpht.com/a/AATXAJyDfH5wBQzXodAnsDtn1HpvTnBS_2jxYgenwg=s32-c-k-c0xffffffff-no-rj-mo","Misleading, do u know he making money",0,"1 year ago",1553007986025,false
,,,,,,,,,,,,"UghuKPTL7kgmNngCoAEC.8VJmRDEky4l8sXUGpQYfdz","bhasilej","/channel/UC1TNIphTMVbTyJE9qfafblw","https://yt3.ggpht.com/a/AATXAJyDfH5wBQzXodAnsDtn1HpvTnBS_2jxYgenwg=s32-c-k-c0xffffffff-no-rj-mo","Ask him what he promotes BM pulser device , another pseudo medicine promoting by him that is colloidal silver products",0,"1 year ago",1553007986026,false
"UgjrS0AOEEgQ0ngCoAEC","kavitha sengu","/channel/UC2T8piluoW3V0EHfJ91IAJA","https://yt3.ggpht.com/a/AATXAJxay6jtabs45Ps_gMcF0Yp6e3DdFePfHAkEQg=s48-c-k-c0xffffffff-no-rj-mo","super class",0,"2 years ago",1521471985726,false,false,,,,,,,,,,,
"UgiPaPZbwYNVI3gCoAEC","Nagesh Ashwath","/channel/UCecHJj1GkAW31gmKegGhARQ","https://yt3.ggpht.com/a/AATXAJxgtcbheBqbFXiW-1Ka8Nm1OIt82n4VJlc6Hw=s48-c-k-c0xffffffff-no-rj-mo","Awesome",1,"2 years ago",1521471985727,false,false,,,,,,,,,,,
"UgjID1rLwpbqb3gCoAEC","Devduttas Sen","/channel/UCLePtK8xlYm0rkLv0W5Ir9w","https://yt3.ggpht.com/a/AATXAJwEbWEdi3HGtUKyzKLl_MVR-JohFbaOzmXyzw=s48-c-k-c0xffffffff-no-rj-mo","According to Dr.Hegde....There is nothing like genetic disease & there is no genetic factor responsible for your conditions.",2,"2 years ago",1521471985727,false,false,,,,,,,,,,,
"UgitEAvk6baO4HgCoAEC","sonu chopra","/channel/UCFJ1XP1DlgUkKeLhszrSIrA","https://yt3.ggpht.com/a/AATXAJwN4SP_FreBXyfXYjQlZ-RHkvSdPNoTJKS7pg=s48-c-k-c0xffffffff-no-rj-mo","sir u r genius.",8,"2 years ago",1521471985728,false,false,,,,,,,,,,,
"UgiXwNBNg08dFHgCoAEC","Rahul Shevde","/channel/UCJI9jCFcnKxly2QfqfQttSQ","https://yt3.ggpht.com/a/AATXAJzk6SquOwVuMLlO6h00W7pFCvRXzyfRvlvwyg=s48-c-k-c0xffffffff-no-rj-mo","Thank you Sir for such a good and unique view towards life !",20,"2 years ago",1521471985729,false,false,,,,,,,,,,,
"Uggl9RQa5rOj6XgCoAEC","Srikala Gawde","/channel/UCJBiSiPZFi8xWtYuJP7r1Aw","https://yt3.ggpht.com/a/AATXAJzB2Oinx9FR-Ty4IhhdwjW87UfIlJ6uauAeyw=s48-c-k-c0xffffffff-no-rj-mo","👌👌👌koti koti pranam Dr.\nfor giving positive advice on health.",37,"2 years ago",1521471985729,false,false,,,,,,,,,,,
"Ugj5C6AmCk1G1ngCoAEC","Madhu Sam","/channel/UCrWfyXwwUgFzbDOg_cSnqkA","https://yt3.ggpht.com/a/AATXAJz_VVBmQDE3w0P8eov1b5blHbTt7TDx1C83dQ=s48-c-k-c0xffffffff-no-rj-mo","He is Gods gift to man kind Salute Dr. B.M. Hegde",129,"2 years ago",1521471985730,false,true,"EkQSC0stbWdtSWphUmxZwAEAyAEA4AEBogINKP___________wFAAMICGxoXaHR0cHM6Ly93d3cueW91dHViZS5jb20iABgGMkcaRRIUVWdqNUM2QW1DazFHMW5nQ29BRUMiAggAKhhVQ3NUMFlJcXducEpDTS1teDctZ1NBNFEyC0stbWdtSWphUmxZQAFICg%3D%3D",9,,,,,,,,,
,,,,,,,,,,,,"Ugj5C6AmCk1G1ngCoAEC.8V7FB4WRVwX8mvnvxqGM2-","Luvanon","/channel/UC_03aJR-U6AneAbO-Nw8Ivg","https://yt3.ggpht.com/a/AATXAJzVRfc7ii-GtQEbNN3yLyfnMtovvqobafTJUA=s32-c-k-c0xffffffff-no-rj-mo","Humankind. 😉",1,"1 year ago",1553007986126,false
,,,,,,,,,,,,"Ugj5C6AmCk1G1ngCoAEC.8V7FB4WRVwX8xJkh23K_Aa","Malli Anumula","/channel/UCSsfM4oLE3KUcaF7yj-rWIg","https://yt3.ggpht.com/a/AATXAJyFpfBPUq6Zvv5ZHIAm0kFDvTNNyHeZX1ptsg=s32-c-k-c0xffffffff-no-rj-mo","does he has health mind, Indian man with English name :)",1,"8 months ago",1563548786127,false
,,,,,,,,,,,,"Ugj5C6AmCk1G1ngCoAEC.8V7FB4WRVwX8xf7KyqaHa0","GSH RDY","/channel/UCrSKmu3gI2PZT6Ucvg3dp_w","https://yt3.ggpht.com/a/AATXAJysPFYJDqYqqEbLHBIzHZAdixLzb-lSRt8jwQ=s32-c-k-c0xffffffff-no-rj-mo","@Malli Anumula , Hegde is English name?",0,"7 months ago",1566227186127,false
,,,,,,,,,,,,"Ugj5C6AmCk1G1ngCoAEC.8V7FB4WRVwX8xizgBPdWfE","Joyce Hearn","/channel/UC5c-Jy-cBcIBBXiHulzmZfA","https://yt3.ggpht.com/a/AATXAJxwpzuHeQwKiEebMFGnTb4NSRiIlb7cWwaK9g=s32-c-k-c0xffffffff-no-rj-mo","Yes, indeed 🤗",0,"7 months ago",1566227186128,false
,,,,,,,,,,,,"Ugj5C6AmCk1G1ngCoAEC.8V7FB4WRVwX8z6xbvHLWVV","jaison antony","/channel/UChIm2XcaU0Kehv79fAKJrMg","https://yt3.ggpht.com/a/AATXAJzJ2RvwQ5N5Rz1jj5LgU24r2KQ6th8nRBQ1oA=s32-c-k-c0xffffffff-no-rj-mo","you got his parent to blame, not him.",1,"6 months ago",1568905586128,false
,,,,,,,,,,,,"Ugj5C6AmCk1G1ngCoAEC.8V7FB4WRVwX9-s0hQmdno2","Shanti Naturechild","/channel/UCB6Cz95G93D4dJM2E2CpmYQ","https://yt3.ggpht.com/a/AATXAJwLC9yvW5lRHUKiIjWgAgFie6SlU8MjcpB1Vg=s32-c-k-c0xffffffff-no-rj-mo","Here is for superficial people who care about people's names or origin and not their knowledge from a Wikipedia article on this doctor :\n""Dr. B. M. Hegde was born on 18 August 1938,[6] in Pangala, Udupi, India, in an ethnic Tulu-Speaking Bunt[7] family""\nMaybe it's simply a language that you don't know seen there are so many in India. There's not only hindi  😉 !",2,"5 months ago",1571497586129,false
,,,,,,,,,,,,"Ugj5C6AmCk1G1ngCoAEC.8V7FB4WRVwX93Srvbxp8wQ","Balkaran Mahabir","/channel/UC7F24qqXG1oZ8fooK0XjWTg","https://yt3.ggpht.com/a/AATXAJy_njxS-OGzQneJ5NY3Wdhq47RQVDdGsz9P4Q=s32-c-k-c0xffffffff-no-rj-mo","Yes u r soo rite he deserves to b honoured. Tnt west Indies said so",0,"2 months ago",1579446386129,false
,,,,,,,,,,,,"Ugj5C6AmCk1G1ngCoAEC.8V7FB4WRVwX93Ss2eCG-bp","Balkaran Mahabir","/channel/UC7F24qqXG1oZ8fooK0XjWTg","https://yt3.ggpht.com/a/AATXAJy_njxS-OGzQneJ5NY3Wdhq47RQVDdGsz9P4Q=s32-c-k-c0xffffffff-no-rj-mo","@Malli Anumula wat can i say bout u. Some things is better when left alone .",0,"2 months ago",1579446386130,false
