"id","author","authorLink","authorThumb","text","likes","time","timestamp","edited","hasReplies","repliesToken","numReplies","reply.id","reply.author","reply.authorLink","reply.authorThumb","reply.text","reply.likes","reply.time","reply.timestamp","reply.edited"
,,,,,,,,,,,,"Ugw12TW9Z4_kmRztGiR4AaABAg.8vgdXNT2kME94EAJJdiEV1","David Chaplin","/channel/UC9bJjdUkPsENYJZyiNOWOjA","https://yt3.ggpht.com/a/AATXAJyxCsCoweSj2vTxl8xTnswCbr-hcsJuvnFdoA=s32-c-k-c0xffffffff-no-rj-mo","You share YOURS ,, I'm keeping mine ,,,,, then you try to FORCE me to share i resist ,, that is how wars begin",0,"1 month ago",1582139801128,false
"Ugw9-QfkctgGQSaX5QR4AaABAg","TeddySpaghetti","/channel/UC0WbLxAD0sgDERlGhQaAqzA","https://yt3.ggpht.com/a/AATXAJxA_PaTGlP72t4LAiEoh7J7KuMSvkAq1RBNlA=s48-c-k-c0xffffffff-no-rj-mo","1:00 I hope the topic of Molten Salt Reactors comes up to solve the problem of storing solar energy overnight (or for weeks at a time).",17,"9 months ago",1560971800883,false,true,"EkQSC0owRmk5WmRuMDdRwAEAyAEA4AEBogINKP___________wFAAMICGxoXaHR0cHM6Ly93d3cueW91dHViZS5jb20iABgGMk0aSxIaVWd3OS1RZmtjdGdHUVNhWDVRUjRBYUFCQWciAggAKhhVQ1czOXp1Zkhmc3VHZ3BMdmlLaDI5N1EyC0owRmk5WmRuMDdRQAFICg%3D%3D",5,,,,,,,,,
,,,,,,,,,,,,"Ugw9-QfkctgGQSaX5QR4AaABAg.8vez2ujrc5D8xb4aENgGa0","maisto","/channel/UCjGia9qX79OyfrgfE2R3AyQ","https://yt3.ggpht.com/a/AATXAJymaaSthlZUscr2-_zc0G7oz-1lOpCtSFOMEg=s32-c-k-c0xffffffff-no-rj-mo","I think flow batteries are more reliable besides the prices of PV panels are going down year after another. You need water to make steam and water is a scarce commodity in deserts.",0,"7 months ago",1566242201181,false
,,,,,,,,,,,,"Ugw9-QfkctgGQSaX5QR4AaABAg.8vez2ujrc5D925YxMzht9J","Space Monkey","/channel/UCtcY61C9-v0G1l8rnGOqt1Q","https://yt3.ggpht.com/a/AATXAJxCENt55eNPQQaVXkLPDrd59Gm-P0QpEVOFHw=s32-c-k-c0xffffffff-no-rj-mo","Hey Teddy, wassup ma man in YouTube! Ex soldier from the Bible Belt...",0,"3 months ago",1576783001181,false
,,,,,,,,,,,,"Ugw9-QfkctgGQSaX5QR4AaABAg.8vez2ujrc5D93wuCqzPob3","George McGovern","/channel/UCkzERiM3HqSyQLrgG4eFqJw","https://yt3.ggpht.com/a/AATXAJyMjm5EK0scegpQ-fcjw6l72SjHEkjD7m-wVA=s32-c-k-c0xffffffff-no-rj-mo","A MSR in Southern Nevada has failed. The molten salt tanks ruptured multiple times and contaminated the soil. Project shutdown.",0,"2 months ago",1579461401182,false
,,,,,,,,,,,,"Ugw9-QfkctgGQSaX5QR4AaABAg.8vez2ujrc5D94BGqwU5oQw","Msam","/channel/UCyXbji1Wdt2inrQHGLzfZ1A","https://yt3.ggpht.com/a/AATXAJz89hqiBv-m1ZGKkCBGwMReoBgwHONirN1DhA=s32-c-k-c0xffffffff-no-rj-mo","@George McGovern the one in morocco is working tho",0,"1 month ago",1582139801182,false
,,,,,,,,,,,,"Ugw9-QfkctgGQSaX5QR4AaABAg.8vez2ujrc5D94r6D7ssAo6","benevolentnick1","/channel/UCmdCkUFwC3zS_5BwzNORvMA","https://yt3.ggpht.com/a/AATXAJxhPzmgedlwKFXSbn13P5L5Z5MV3Trrh-GBhQ=s32-c-k-c0xffffffff-no-rj-mo","nice point, think graphene tech would definitely make such thoughts more than viable. Doesn't mean it would ever be considered except where the public pay for it so private hands own it.  If we come close, the harry potter gen will think their magic will need to be considered. what could possibly go wrong?",0,"1 month ago",1582139801183,false
"Ugx6a5CWQ4Ye5cyo5Cx4AaABAg","Blue Solar Home","/channel/UCqZ_rTTy9Zrk4GV5Hv8RpMg","https://yt3.ggpht.com/a/AATXAJxyMgtPgGQCbaIpqiO2kLqR6AJ2yqnZm_mmGA=s48-c-k-c0xffffffff-no-rj-mo","Where can we watch it in german and/or spanish?",1,"9 months ago",1560971800884,true,true,"EkQSC0owRmk5WmRuMDdRwAEAyAEA4AEBogINKP___________wFAAMICGxoXaHR0cHM6Ly93d3cueW91dHViZS5jb20iABgGMk0aSxIaVWd4NmE1Q1dRNFllNWN5bzVDeDRBYUFCQWciAggAKhhVQ1czOXp1Zkhmc3VHZ3BMdmlLaDI5N1EyC0owRmk5WmRuMDdRQAFICg%3D%3D",1,,,,,,,,,
,,,,,,,,,,,,"Ugx6a5CWQ4Ye5cyo5Cx4AaABAg.8ve4LOM3DEt954hH3VhSeT","Jobs mine","/channel/UCzNtLYHomdfGYF8_NqiB5Zw","https://yt3.ggpht.com/a/AATXAJxfAQ1TSJE5Lj0o_BnPFZ2jofssu44AmsTKBA=s32-c-k-c0xffffffff-no-rj-mo","Blue Solar Home this’s for English only.",0,"1 month ago",1582139801157,false
"UgxqplJoyDQrj_qCqXt4AaABAg","jesse weed","/channel/UC-LmAy_kCiQBQ1uvSvXZE5g","https://yt3.ggpht.com/a/AATXAJyCLeDlqfmYGLPRUTU3gXOqqeQxbcWpcKL4OQ=s48-c-k-c0xffffffff-no-rj-mo","solar power is cool but with constant  suppressing of the tech we could have and what we receive and geoenginerring will make it useless",2,"9 months ago",1560971800885,true,true,"EkQSC0owRmk5WmRuMDdRwAEAyAEA4AEBogINKP___________wFAAMICGxoXaHR0cHM6Ly93d3cueW91dHViZS5jb20iABgGMk0aSxIaVWd4cXBsSm95RFFyal9xQ3FYdDRBYUFCQWciAggAKhhVQ1czOXp1Zkhmc3VHZ3BMdmlLaDI5N1EyC0owRmk5WmRuMDdRQAFICg%3D%3D",1,,,,,,,,,
,,,,,,,,,,,,"UgxqplJoyDQrj_qCqXt4AaABAg.8vdq5ZT7Usz93oguhjK3XS","m m","/channel/UCR1CBFvzLdnbyuI9WM5OIGQ","https://yt3.ggpht.com/a/AATXAJwFE6URW0bRu9wr2R-Oh63rFuRXnxxiiJVXZg=s32-c-k-c0xffffffff-no-rj-mo","Must be american",0,"2 months ago",1579461401156,false
"UgzRIqkbGk1nxbQViOZ4AaABAg","Trevor Hembruff","/channel/UCaXUIBSDivCZ0YWBK2VYBFQ","https://yt3.ggpht.com/a/AATXAJwAikqpWvfRoOyJ4Uau4eRt4CF8-wOE0rEnTQ=s48-c-k-c0xffffffff-no-rj-mo","Would it be possible to have a helicopter flying relatively low, drag a very large platform. The platform would have rope and ladders all around to climb i.c.e.  A narrow perimeter, and a cushy middle to land.\n  That way the energy provider could purchase their own helicopter and train and or employ pilots. Quickly compensating cost from saving on triple maintenance charges.",1,"9 months ago",1560971800886,false,true,"EkQSC0owRmk5WmRuMDdRwAEAyAEA4AEBogINKP___________wFAAMICGxoXaHR0cHM6Ly93d3cueW91dHViZS5jb20iABgGMk0aSxIaVWd6Uklxa2JHazFueGJRVmlPWjRBYUFCQWciAggAKhhVQ1czOXp1Zkhmc3VHZ3BMdmlLaDI5N1EyC0owRmk5WmRuMDdRQAFICg%3D%3D",1,,,,,,,,,
,,,,,,,,,,,,"UgzRIqkbGk1nxbQViOZ4AaABAg.8vc7Wbb2WO58vySH57sCVm","Joseph Huang","/channel/UCEjCTlpt4UyjvuOLR9ZIcdg","https://yt3.ggpht.com/a/AATXAJyhhhJbwI7MeKfgh-8fzHKy9NEJmQ_bQHoCCw=s32-c-k-c0xffffffff-no-rj-mo","helicopters are like 1k/hr or more.",1,"9 months ago",1560971801164,true
"UgyIc1KF4HgI6TOj1Ph4AaABAg","Grey Virus","/channel/UC8ZncrH4sOE08095wc3gljw","https://yt3.ggpht.com/a/AATXAJy4gd3OV7Pb7NKELionXY0UowjPXYlF_WN6IQ=s48-c-k-c0xffffffff-no-rj-mo","I hated this doc, all I see is how the rich are getting richer monopolizing everything around them and all the new tech.",0,"9 months ago",1560971800887,false,false,,,,,,,,,,,
"UgzajI979l-b6xorYml4AaABAg","sdrawkcabgnipytmi","/channel/UCFpWGuRj6bDYFo_vjztUC0g","https://yt3.ggpht.com/a/AATXAJx33-WsPVo0qqVD9rgxvr_CTsWhrODepOZNVQ=s48-c-k-c0xffffffff-no-rj-mo","21:17\nWhat's with the UFOs?",5,"9 months ago",1560971800887,false,true,"EkQSC0owRmk5WmRuMDdRwAEAyAEA4AEBogINKP___________wFAAMICGxoXaHR0cHM6Ly93d3cueW91dHViZS5jb20iABgGMk0aSxIaVWd6YWpJOTc5bC1iNnhvclltbDRBYUFCQWciAggAKhhVQ1czOXp1Zkhmc3VHZ3BMdmlLaDI5N1EyC0owRmk5WmRuMDdRQAFICg%3D%3D",1,,,,,,,,,
,,,,,,,,,,,,"UgzajI979l-b6xorYml4AaABAg.8vbRZRVaAs28vnhShMhe6_","Jason Bourney","/channel/UCQpDyQUb0f4VaSu-BdqqYyQ","https://yt3.ggpht.com/a/AATXAJxro_4o07fjASkarvlb4lE721glOQO2I3qQKQ=s32-c-k-c0xffffffff-no-rj-mo","good catch",0,"9 months ago",1560971801158,false
"UgzIgwmSQ1ll6c7kUSZ4AaABAg","John Russell","/channel/UCSALOBN8husbwnHY3abCxig","https://yt3.ggpht.com/a/AATXAJyMHH24ph9Y_KsefYcpM5IllXLE91Yp1IkpGA=s48-c-k-c0xffffffff-no-rj-mo","WHEN ARE WE GOING TO START USING COLD FUSION AND ZERO POINT ENERGY DISCOVERED BY TESLA 100 YEARS AGO... ???",0,"9 months ago",1560971800888,false,false,,,,,,,,,,,
"UgxS3OZi0FnBBX5xYPp4AaABAg","WanderLust","/channel/UCCarOTFs9t1GD1v2rXg8sfA","https://yt3.ggpht.com/a/AATXAJy1aqrlMw3rom2gYDk0PQuVc8tinxeSW_Q-ew=s48-c-k-c0xffffffff-no-rj-mo","Great documentary with quality content as always :) Big changes are needed to fight climate change!",7,"9 months ago",1560971800889,false,false,,,,,,,,,,,
"Ugw3Hlf2hR8gDImIW4t4AaABAg","Big Red","/channel/UCbTYAGbIzPnaAWI30vXKvbw","https://yt3.ggpht.com/a/AATXAJwQ-YHeY6fKisGPZjaEVB-BqfcfSsebR_1r3Q=s48-c-k-c0xffffffff-no-rj-mo","I am surprised that with the development of the solar electricity generation plant, that they also don't go with low consumption LED lighting inside their homes. LED's use far less energy and are cheap to buy!",1,"9 months ago",1560971800889,false,false,,,,,,,,,,,
"UgzuNb90wwA0VdQpzd94AaABAg","Bart S","/channel/UC-_ahCe5lvCe1S3zDosGUyA","https://yt3.ggpht.com/a/AATXAJwtaIIKyDmIHaGRn4jmUx7Et1xB01pTVMyUmw=s48-c-k-c0xffffffff-no-rj-mo","So funny .... like the earth would need to be saved.",0,"9 months ago",1560971801612,false,false,,,,,,,,,,,
"UgwYT1J12HXKj55Zwhh4AaABAg","AJ B","/channel/UCYzIEqlxx3p2yccqWM1HPbA","https://yt3.ggpht.com/a/AATXAJys9vOHsDpSnIeTIP9TKuLBpDAlpYFXGLBohQ=s48-c-k-c0xffffffff-no-rj-mo","Hi,Also there is solar in a spray can! There are solar cells which get energy from the rain water hitting the cell which causes a reaction! Great for the wet lands.",0,"9 months ago",1560971801613,false,false,,,,,,,,,,,
"Ugx73Qg2NyvbsY8UTH54AaABAg","AJ B","/channel/UCYzIEqlxx3p2yccqWM1HPbA","https://yt3.ggpht.com/a/AATXAJys9vOHsDpSnIeTIP9TKuLBpDAlpYFXGLBohQ=s48-c-k-c0xffffffff-no-rj-mo","How about a hand crank. I have a wind up radio/torch, couldn't we use the same principals, nano style generator, etc ,litteraly turn the crank, Its a little exercise also.",0,"9 months ago",1560971801613,false,true,"EkQSC0owRmk5WmRuMDdRwAEAyAEA4AEBogINKP___________wFAAMICGxoXaHR0cHM6Ly93d3cueW91dHViZS5jb20iABgGMk0aSxIaVWd4NzNRZzJOeXZic1k4VVRINTRBYUFCQWciAggAKhhVQ1czOXp1Zkhmc3VHZ3BMdmlLaDI5N1EyC0owRmk5WmRuMDdRQAFICg%3D%3D",1,,,,,,,,,
,,,,,,,,,,,,"Ugx73Qg2NyvbsY8UTH54AaABAg.8vaFKHadEVc94ECsJYyprr","David Chaplin","/channel/UC9bJjdUkPsENYJZyiNOWOjA","https://yt3.ggpht.com/a/AATXAJyxCsCoweSj2vTxl8xTnswCbr-hcsJuvnFdoA=s32-c-k-c0xffffffff-no-rj-mo","I will put a cage on the front of my car ,, you can live there and crank",0,"1 month ago",1582139801900,false
"UgzJmoHkXLyL3wYhx7p4AaABAg","Debbie Krallman","/channel/UC-gKPAzDWU8F-s8A1Hn_h4g","https://yt3.ggpht.com/a/AATXAJyOBNtxMaETgp3MCFwcX2nu6afgEHiaLUZ4WA=s48-c-k-c0xffffffff-no-rj-mo","Thorium",0,"9 months ago",1560971801614,false,false,,,,,,,,,,,
"Ugx4DuV_hXWzwzv2jFl4AaABAg","Debbie Krallman","/channel/UC-gKPAzDWU8F-s8A1Hn_h4g","https://yt3.ggpht.com/a/AATXAJyOBNtxMaETgp3MCFwcX2nu6afgEHiaLUZ4WA=s48-c-k-c0xffffffff-no-rj-mo","Free energy is out there and they know it.",1,"9 months ago",1560971801614,false,true,"EkQSC0owRmk5WmRuMDdRwAEAyAEA4AEBogINKP___________wFAAMICGxoXaHR0cHM6Ly93d3cueW91dHViZS5jb20iABgGMk0aSxIaVWd4NER1Vl9oWFd6d3p2MmpGbDRBYUFCQWciAggAKhhVQ1czOXp1Zkhmc3VHZ3BMdmlLaDI5N1EyC0owRmk5WmRuMDdRQAFICg%3D%3D",1,,,,,,,,,
,,,,,,,,,,,,"Ugx4DuV_hXWzwzv2jFl4AaABAg.8v_fpwWDyvl94ECcKSYEoN","David Chaplin","/channel/UC9bJjdUkPsENYJZyiNOWOjA","https://yt3.ggpht.com/a/AATXAJyxCsCoweSj2vTxl8xTnswCbr-hcsJuvnFdoA=s32-c-k-c0xffffffff-no-rj-mo","Waiting for ET to bring it",0,"1 month ago",1582139801944,false
"Ugxk9V9vAjVR-abngap4AaABAg","chris r","/channel/UCQZF69prwJx34oCQioZZHxA","https://yt3.ggpht.com/a/AATXAJwql9sH6PTwKKQchJEPcwvzPTJSHW58Y9tMxg=s48-c-k-c0xffffffff-no-rj-mo","Has anyone noticed that the climate is not changing?",1,"9 months ago",1560971801615,false,false,,,,,,,,,,,
"UgxNa0dq2EOWdOApVQJ4AaABAg","ANTERIOR","/channel/UCwia8SryCbaRN7KwMWeOjvQ","https://yt3.ggpht.com/a/AATXAJxtu3_YjES_E_F2lp4I5Un01VjGYGyyVAT0-Q=s48-c-k-c0xffffffff-no-rj-mo","Forgive me for my ignorance, but why aren't we just putting giant solar farms up in space? Wouldn't it be possible to collect way more energy that way and also completely eliminate the need for giant solar farms on Earth. They'd probably also be way more effective considering the sun will always shine and the atmosphere wouldn't block/reflect any of the sunlight. I have no idea how we transport it from space to Earth though, but I'm sure it's possible.",0,"9 months ago",1560971801616,true,false,,,,,,,,,,,
"UgyKWWfYqdUfpp9wUGt4AaABAg","Jason Roberts","/channel/UCuHoBUFgrNxf_ZQOf0yuqXA","https://yt3.ggpht.com/a/AATXAJygoXconXsb3p69sQcG-OS_vp4PifTGjEwiog=s48-c-k-c0xffffffff-no-rj-mo","The sun is hawt and far away.....I'm all for sand as fuel!",2,"9 months ago",1560971801617,false,false,,,,,,,,,,,
"UgzhMnyJAXSZZwAwYht4AaABAg","Mimi B","/channel/UC4BnM0nYNHuw6umndgilSag","https://yt3.ggpht.com/a/AATXAJwBxceYOtQVW7sQ2--BfNbsG2VjmvDLSMzHdw=s48-c-k-c0xffffffff-no-rj-mo","Dig the out of the box highway solar idea though",0,"9 months ago",1560971801617,false,false,,,,,,,,,,,
"UgwMZQ5oCLUo_VKMl954AaABAg","Maria Schick","/channel/UCGqpd_09rE_gkGddWSs5veA","https://yt3.ggpht.com/a/AATXAJwRrpvaSAOHrVCJ3pMRFX2Tp3nI2rT6MUGQlg=s48-c-k-c0xffffffff-no-rj-mo","Please please, Green parties raise the carbon taxes much higher maybe 8000  euro per ton until we reach 0 carbon emissions.\nPlease raise our taxes while Chinese and India keep pumping out massive amounts of pollution. Thank you 👌",0,"9 months ago",1560971801618,false,false,,,,,,,,,,,
"Ugzzqf13qyaOMZ25l6B4AaABAg","Maria Schick","/channel/UCGqpd_09rE_gkGddWSs5veA","https://yt3.ggpht.com/a/AATXAJwRrpvaSAOHrVCJ3pMRFX2Tp3nI2rT6MUGQlg=s48-c-k-c0xffffffff-no-rj-mo","The Green parties are same as communist.",0,"9 months ago",1560971801618,false,false,,,,,,,,,,,
"UgwsBOIT3b1o6bPlVWx4AaABAg","Roger Olsson","/channel/UCiYW8IZB21oN3M53C_4yagA","https://yt3.ggpht.com/a/AATXAJwU4VKEo6tTU3Brq40qtY6ITh_9vIrynBwZig=s48-c-k-c0xffffffff-no-rj-mo","Bull.. Germany cant export energy from solar or wind because it's so expensive that their own citizens cant even afford it..",3,"9 months ago",1560971801619,false,true,"EkQSC0owRmk5WmRuMDdRwAEAyAEA4AEBogINKP___________wFAAMICGxoXaHR0cHM6Ly93d3cueW91dHViZS5jb20iABgGMk0aSxIaVWd3c0JPSVQzYjFvNmJQbFZXeDRBYUFCQWciAggAKhhVQ1czOXp1Zkhmc3VHZ3BMdmlLaDI5N1EyC0owRmk5WmRuMDdRQAFICg%3D%3D",2,,,,,,,,,
,,,,,,,,,,,,"UgwsBOIT3b1o6bPlVWx4AaABAg.8vZU6jegZpC93og4FBR6UD","m m","/channel/UCR1CBFvzLdnbyuI9WM5OIGQ","https://yt3.ggpht.com/a/AATXAJwFE6URW0bRu9wr2R-Oh63rFuRXnxxiiJVXZg=s32-c-k-c0xffffffff-no-rj-mo","Salty american?",0,"2 months ago",1579461401985,false
,,,,,,,,,,,,"UgwsBOIT3b1o6bPlVWx4AaABAg.8vZU6jegZpC93ogb4ZR6dN","m m","/channel/UCR1CBFvzLdnbyuI9WM5OIGQ","https://yt3.ggpht.com/a/AATXAJwFE6URW0bRu9wr2R-Oh63rFuRXnxxiiJVXZg=s32-c-k-c0xffffffff-no-rj-mo","Imagine being this insecure while living in a dump of a country. MAGA indeed",0,"2 months ago",1579461401985,false
"Ugxs1tELy125Cfgm9vN4AaABAg","An Archy","/channel/UCD0k1zR3AN85UkWRg6fTZSw","https://yt3.ggpht.com/a/AATXAJzD96XbbqK1nt7GnVHmEdWGt2tnei52QqHZVQ=s48-c-k-c0xffffffff-no-rj-mo","Natural climate change associated with the grand solar minimum mini ice age of the 1600's has returned for its 400 year cycle, expect radical weather, meridional jet stream flow, record snowfalls, glacial growth, Polar Bear population booms, falling sea levels, blooming deserts, galactic influences, cosmic rays, wandering magnetic poles, volcanic uptick, earthquakes, mud floods and associated catastrophes with famine from crop failures leading to peak food shock and real climate migration, which has NOTHING to do with the man-made co2 global warming climate change myth. See ice age farmer, ice age now, adapt 2030, John Casey, grand solar minimum news, etc.",0,"9 months ago",1560971801620,false,false,,,,,,,,,,,
"Ugx2rr5k6qKPgOQXTT54AaABAg","Syed Imran Shah","/channel/UC4NPQ3H2ZpMuqmoTVC_yBoA","https://yt3.ggpht.com/a/AATXAJyKhaMBH13kQ97fqb36FrmyP7jrkaH30DEu=s48-c-k-c0xffffffff-no-rj-mo","Ok but there are already many many customers in his store. He does not need another customer.",0,"9 months ago",1560971801620,false,false,,,,,,,,,,,
"UgxnDoYTrEZyHZeb4dF4AaABAg","Balasibasem O Innas O Innas","/channel/UCcD-rc0M-WqVH_18lE7UnrA","https://yt3.ggpht.com/a/AATXAJyzLH3e-5F9Xl7K5HIqOi3ZSWXvPerlQpnfXA=s48-c-k-c0xffffffff-no-rj-mo","I think there is nothing wrong with energy hunger but it’s definitely wrong to be greedy. Everyone wants to hog energy. We rarely desire to produce energy for everyone.",0,"9 months ago",1560971801621,false,false,,,,,,,,,,,
"Ugwz2YCVqZZDUEaA5pJ4AaABAg","sprinx elminster","/channel/UCDX-p8bYDwoJIESx7c8n3PA","https://yt3.ggpht.com/a/AATXAJy_VwZe22OL5ox4ZczC2RoaUYlmOLfZSoJ4Aw=s48-c-k-c0xffffffff-no-rj-mo","huh, a fake concept of material wealth keeping people in poverty? that's new af!!!",3,"9 months ago",1560971801622,false,true,"EkQSC0owRmk5WmRuMDdRwAEAyAEA4AEBogINKP___________wFAAMICGxoXaHR0cHM6Ly93d3cueW91dHViZS5jb20iABgGMk0aSxIaVWd3ejJZQ1ZxWlpEVUVhQTVwSjRBYUFCQWciAggAKhhVQ1czOXp1Zkhmc3VHZ3BMdmlLaDI5N1EyC0owRmk5WmRuMDdRQAFICg%3D%3D",1,,,,,,,,,
,,,,,,,,,,,,"Ugwz2YCVqZZDUEaA5pJ4AaABAg.8vYn4Glf02u8v_x7t7Jgds","CanadaCommunity Org","/channel/UCeaRAd82FJZuzkmgfZ1I3tQ","https://yt3.ggpht.com/a/AATXAJzL59CswFWUW0hqd_ehCzg7dmIqviKonJ_v0Q=s32-c-k-c0xffffffff-no-rj-mo","sprinx elminster\r""huh, a fake concept ""\nVery https://canadacommunity.org/Thread-Clean-Energy-technology-inventions-that-can-eliminate-pollution true!",0,"9 months ago",1560971801936,false
"UgwBHJWNOrCwz-QwaqB4AaABAg","Shamoun Kyriakos","/channel/UCLl3rCsLDtTMVm10GVu7gUg","https://yt3.ggpht.com/a/AATXAJzn8oukFtiCtHYG6cCA5C9C-VvLwCRA-rhcQA=s48-c-k-c0xffffffff-no-rj-mo","Those who pollute most in Europe are Germany and Poland who use coal power.",1,"9 months ago",1560971801623,false,true,"EkQSC0owRmk5WmRuMDdRwAEAyAEA4AEBogINKP___________wFAAMICGxoXaHR0cHM6Ly93d3cueW91dHViZS5jb20iABgGMk0aSxIaVWd3QkhKV05PckN3ei1Rd2FxQjRBYUFCQWciAggAKhhVQ1czOXp1Zkhmc3VHZ3BMdmlLaDI5N1EyC0owRmk5WmRuMDdRQAFICg%3D%3D",1,,,,,,,,,
,,,,,,,,,,,,"UgwBHJWNOrCwz-QwaqB4AaABAg.8vYmkWZ2f8X8xTvYuebEEx","Me AndMeToo","/channel/UCyjqpaZdGpeqA8w2X1hPRzw","https://yt3.ggpht.com/a/AATXAJwvohcyj39-yaBm6xuHIestO_ebx3xaaoP4qw=s32-c-k-c0xffffffff-no-rj-mo","Poland has made order for nuclear power plants.",1,"8 months ago",1563563801929,false
"Ugxtz_oD0tNeZMN3HfN4AaABAg","Eric","/channel/UC2o9ELaB2S90JUf6CpKe_Rw","https://yt3.ggpht.com/a/AATXAJyV0M_pSD_nzpwDFxpNB_iBDL9Mn4JMRhvI3Q=s48-c-k-c0xffffffff-no-rj-mo","There is no reason we cannot rely on Solar and wind and tide and when there none of these each house can have battery back up. We do not need coal at all.",0,"9 months ago",1560971801624,false,false,,,,,,,,,,,
"UgyFd_AaJVOZ05I5p614AaABAg","Craig Jeffrey","/channel/UC9bppeHTDG3KtKgmCAoRocQ","https://yt3.ggpht.com/a/AATXAJx987pVTwVVr_iybbYlh9_wFsL3aiO6LoPUiw=s48-c-k-c0xffffffff-no-rj-mo","Why don't these 'experts' even mention Zero Point Energy..?...Because it would be free....",3,"9 months ago",1560971801624,false,true,"EkQSC0owRmk5WmRuMDdRwAEAyAEA4AEBogINKP___________wFAAMICGxoXaHR0cHM6Ly93d3cueW91dHViZS5jb20iABgGMk0aSxIaVWd5RmRfQWFKVk9aMDVJNXA2MTRBYUFCQWciAggAKhhVQ1czOXp1Zkhmc3VHZ3BMdmlLaDI5N1EyC0owRmk5WmRuMDdRQAFICg%3D%3D",2,,,,,,,,,
,,,,,,,,,,,,"UgyFd_AaJVOZ05I5p614AaABAg.8vYUkI5Nhr28vy0qtRcnCW","Ferdinand Wohlrab","/channel/UCL2Ec8x9rKU8YEyk_NDtLyw","https://yt3.ggpht.com/a/AATXAJy6h9gAlJF_DPfHCcPjItqayXT08mH41mqHIg=s32-c-k-c0xffffffff-no-rj-mo","Not possible to utilize",0,"9 months ago",1560971801940,false
,,,,,,,,,,,,"UgyFd_AaJVOZ05I5p614AaABAg.8vYUkI5Nhr28vyQds_DGnQ","Craig Jeffrey","/channel/UC9bppeHTDG3KtKgmCAoRocQ","https://yt3.ggpht.com/a/AATXAJx987pVTwVVr_iybbYlh9_wFsL3aiO6LoPUiw=s32-c-k-c0xffffffff-no-rj-mo","@Ferdinand Wohlrab It will be....There's a lot going on which Media do not cover.",0,"9 months ago",1560971801941,false
"UgyGGcyISxmHyq_vGDh4AaABAg","First Last","/channel/UCPrSAFcuqY-BcVMapaq9Mkg","https://yt3.ggpht.com/a/AATXAJx_dpsZpoC_bIdnf-3QIoT1je0FY_R3RQhxeA=s48-c-k-c0xffffffff-no-rj-mo","To even consider nuclear is a grave error. With Fukushima still hemorrhaging 400 tons of highly radioactive water into the Pacific every day (admitted) since March 11, 2011, the Pacific is 95% dead, with the other oceans soon to follow.",1,"9 months ago",1560971801626,false,false,,,,,,,,,,,
"Ugx3mIntWjEbVIGDQ0V4AaABAg","First Last","/channel/UCPrSAFcuqY-BcVMapaq9Mkg","https://yt3.ggpht.com/a/AATXAJx_dpsZpoC_bIdnf-3QIoT1je0FY_R3RQhxeA=s48-c-k-c0xffffffff-no-rj-mo","To even consider nuclear is a grave error. With Fukushima still hemorrhaging 400 tons of highly radioactive water into the Pacific every day (admitted) since March 11, 2011, the Pacific is 95% dead, with the other oceans soon to follow.",1,"9 months ago",1560971802457,false,false,,,,,,,,,,,
"Ugy9TgTzebbWne3i9xp4AaABAg","First Last","/channel/UCPrSAFcuqY-BcVMapaq9Mkg","https://yt3.ggpht.com/a/AATXAJx_dpsZpoC_bIdnf-3QIoT1je0FY_R3RQhxeA=s48-c-k-c0xffffffff-no-rj-mo","Here's a crazy thought: A side benefit of Geo-engineering and chemtrails is that there is less sunlight hitting the earth, thereby hurting solar. Since even slight angles affect power output, I'd think a 20% reduction in sunlight would put a very big dent in the solar industry, a victory for fossil fuels.",1,"9 months ago",1560971802459,false,false,,,,,,,,,,,
"UgySeNGiymnMRQRL2bF4AaABAg","Russell Grant Appling","/channel/UCaAku4zrDvUtUq0NX2QHSAg","https://yt3.ggpht.com/a/AATXAJyjKvOTNP44x1llyuEhF6aUcqoKPcGtpLJNPw=s48-c-k-c0xffffffff-no-rj-mo","May all residents of those thirteen cities be compensated. $42,018.00 per year. Each.",6,"9 months ago",1560971802460,true,false,,,,,,,,,,,
"Ugx_XNtwthasxUBMYzx4AaABAg","Russell Grant Appling","/channel/UCaAku4zrDvUtUq0NX2QHSAg","https://yt3.ggpht.com/a/AATXAJyjKvOTNP44x1llyuEhF6aUcqoKPcGtpLJNPw=s48-c-k-c0xffffffff-no-rj-mo","I'm a six thousand year planner.",1,"9 months ago",1560971802461,true,true,"EkQSC0owRmk5WmRuMDdRwAEAyAEA4AEBogINKP___________wFAAMICGxoXaHR0cHM6Ly93d3cueW91dHViZS5jb20iABgGMk0aSxIaVWd4X1hOdHd0aGFzeFVCTVl6eDRBYUFCQWciAggAKhhVQ1czOXp1Zkhmc3VHZ3BMdmlLaDI5N1EyC0owRmk5WmRuMDdRQAFICg%3D%3D",2,,,,,,,,,
,,,,,,,,,,,,"Ugx_XNtwthasxUBMYzx4AaABAg.8vXyhFLyLPl91ftqo4XB9R","Steven Moore","/channel/UCCZ4Tfb-MCSTG_fcjL_LlFA","https://yt3.ggpht.com/a/AATXAJznuykZxSRD8Jejzhu6BN56bddcYEPfJ7yvRg=s32-c-k-c0xffffffff-no-rj-mo","Looking forward to watching your documentary. BTW when is it coming out",0,"3 months ago",1576783002760,false
,,,,,,,,,,,,"Ugx_XNtwthasxUBMYzx4AaABAg.8vXyhFLyLPl92rBv1ageIi","XTreMe2k6","/channel/UCJ96-whbuotxVLNY2uYkfdA","https://yt3.ggpht.com/a/AATXAJyTP3HbIt2eQwPUhSqVJCcycTSiuww7G1FHZg=s32-c-k-c0xffffffff-no-rj-mo","@Steven Moore in 6000 years",0,"2 months ago",1579461402760,false
"UgyG9WEVSX08Oo4DFph4AaABAg","Russell Grant Appling","/channel/UCaAku4zrDvUtUq0NX2QHSAg","https://yt3.ggpht.com/a/AATXAJyjKvOTNP44x1llyuEhF6aUcqoKPcGtpLJNPw=s48-c-k-c0xffffffff-no-rj-mo","42:26 and before so be it get it done. And make sure you have my Apt available for me. you will trade only with those that exit the EU. And none others.england and France this far. I have no problem with hydro electric. It's awesome. Thanks to Tesla. It is in your homes today.",0,"9 months ago",1560971802463,true,false,,,,,,,,,,,
"UgxK9Z8FWLxe-_hh2Nx4AaABAg","Russell Grant Appling","/channel/UCaAku4zrDvUtUq0NX2QHSAg","https://yt3.ggpht.com/a/AATXAJyjKvOTNP44x1llyuEhF6aUcqoKPcGtpLJNPw=s48-c-k-c0xffffffff-no-rj-mo","They should go to the exit countries. From the EU. And get those contracts.",0,"9 months ago",1560971802464,false,false,,,,,,,,,,,
"Ugzqt8ic52jgzAqcuG14AaABAg","Russell Grant Appling","/channel/UCaAku4zrDvUtUq0NX2QHSAg","https://yt3.ggpht.com/a/AATXAJyjKvOTNP44x1llyuEhF6aUcqoKPcGtpLJNPw=s48-c-k-c0xffffffff-no-rj-mo","They should be placed on individual houses.",3,"9 months ago",1560971802465,false,true,"EkQSC0owRmk5WmRuMDdRwAEAyAEA4AEBogINKP___________wFAAMICGxoXaHR0cHM6Ly93d3cueW91dHViZS5jb20iABgGMk0aSxIaVWd6cXQ4aWM1MmpnekFxY3VHMTRBYUFCQWciAggAKhhVQ1czOXp1Zkhmc3VHZ3BMdmlLaDI5N1EyC0owRmk5WmRuMDdRQAFICg%3D%3D",1,,,,,,,,,
,,,,,,,,,,,,"Ugzqt8ic52jgzAqcuG14AaABAg.8vXwW-dt8UZ94EAR0Lqb8_","David Chaplin","/channel/UC9bJjdUkPsENYJZyiNOWOjA","https://yt3.ggpht.com/a/AATXAJyxCsCoweSj2vTxl8xTnswCbr-hcsJuvnFdoA=s32-c-k-c0xffffffff-no-rj-mo","And who pays?",0,"1 month ago",1582139802756,false
"UgwKREhl3SeBSDtDaD94AaABAg","John Hall","/channel/UCahcAmQwvkbYTzaHTrnYcGA","https://yt3.ggpht.com/a/AATXAJyMFGz2GoEK7CesGNl9OsON5votC6jqE8_gTA=s48-c-k-c0xffffffff-no-rj-mo","Why not work on a gravity turbine.",0,"9 months ago",1560971802467,false,false,,,,,,,,,,,
"UgxCMRcR5-j0wZLOOP94AaABAg","Russell Grant Appling","/channel/UCaAku4zrDvUtUq0NX2QHSAg","https://yt3.ggpht.com/a/AATXAJyjKvOTNP44x1llyuEhF6aUcqoKPcGtpLJNPw=s48-c-k-c0xffffffff-no-rj-mo","I own all intellectual property for the solar farms. And wind farms. And I have proof.",0,"9 months ago",1560971802468,false,true,"EkQSC0owRmk5WmRuMDdRwAEAyAEA4AEBogINKP___________wFAAMICGxoXaHR0cHM6Ly93d3cueW91dHViZS5jb20iABgGMk0aSxIaVWd4Q01SY1I1LWowd1pMT09QOTRBYUFCQWciAggAKhhVQ1czOXp1Zkhmc3VHZ3BMdmlLaDI5N1EyC0owRmk5WmRuMDdRQAFICg%3D%3D",2,,,,,,,,,
,,,,,,,,,,,,"UgxCMRcR5-j0wZLOOP94AaABAg.8vXuzGd6s0t8vY1CxMjZ9o","Pietro Bembo","/channel/UCAEz1SSmuC8nDUGNHp7IWAg","https://yt3.ggpht.com/a/AATXAJzXw993tGto0Cq4z4uGO2EaWrEcQNBC6L_r0g=s32-c-k-c0xffffffff-no-rj-mo","Fantastic",0,"9 months ago",1560971802771,false
,,,,,,,,,,,,"UgxCMRcR5-j0wZLOOP94AaABAg.8vXuzGd6s0t91fu-LNcQ9M","Steven Moore","/channel/UCCZ4Tfb-MCSTG_fcjL_LlFA","https://yt3.ggpht.com/a/AATXAJznuykZxSRD8Jejzhu6BN56bddcYEPfJ7yvRg=s32-c-k-c0xffffffff-no-rj-mo","So sorry for you that everybody else has taken it.",0,"3 months ago",1576783002772,false
"Ugw6dvP4RGQW29L96Nt4AaABAg","Stephen Verchinski","/channel/UCocVAUzqXHT0t406mGgHBkQ","https://yt3.ggpht.com/a/AATXAJzLn-LLM_5118EQDU7QV2IooD3hAwvFhC0tvA=s48-c-k-c0xffffffff-no-rj-mo","World Bank seems interested in extracting wealth.",3,"9 months ago",1560971802469,false,false,,,,,,,,,,,
"UgxCrMb0vOQZRuStCBR4AaABAg","Sagittarius A*","/channel/UC_36afAP8LCrVPztHhBNZag","https://yt3.ggpht.com/a/AATXAJzRhWI0VS-0hWVFh2yQV62x4QBOHJ1OHTrBWA=s48-c-k-c0xffffffff-no-rj-mo","Costs, costs, costs ... as long as everything is about money, little will change.",4,"9 months ago",1560971802470,false,false,,,,,,,,,,,
