"id","author","authorLink","authorThumb","text","likes","time","timestamp","edited","hasReplies","repliesToken","numReplies","reply.id","reply.author","reply.authorLink","reply.authorThumb","reply.text","reply.likes","reply.time","reply.timestamp","reply.edited"
,,,,,,,,,,,,"UgxupWdUomAFLmjMh9J4AaABAg.8WTQefYjwK98urGsisnlWs","Simon Wood","/channel/UCmmIL7kM1_dfGDqOnaqJnyw","https://yt3.ggpht.com/a/AATXAJy9POy4KRe3E0wI_iaRqZQLAV0KrA6ii-yYog=s32-c-k-c0xffffffff-no-rj-mo","Great India",5,"10 months ago",1558278365368,false
"Ugyi3K8nmvJSiSQmKZ54AaABAg","dipesh","/channel/UC7T1LMJ-rR7Dz5_5VF_nz3w","https://yt3.ggpht.com/a/AATXAJwgfYDrW3GNIgtXkz-qTRJiqzjKwsU7bGH3pg=s48-c-k-c0xffffffff-no-rj-mo","Solar and other renewable sources are the future. Tesla is revolutionising car market with electric cars. What we need here in India is innovation in electric bikes that provide same performance as petrol bikes. Electric automobiles coupled with renewable electricity for charging will help us to meet emission targets.",35,"2 years ago",1521471964929,false,true,"EkQSC3NrMG1ZSEhXbFlrwAEAyAEA4AEBogINKP___________wFAAMICGxoXaHR0cHM6Ly93d3cueW91dHViZS5jb20iABgGMk0aSxIaVWd5aTNLOG5tdkpTaVNRbUtaNTRBYUFCQWciAggAKhhVQ2xrNTVzZElSQ3J4SHRKZTE3YmljQ2cyC3NrMG1ZSEhXbFlrQAFICg%3D%3D",2,,,,,,,,,
,,,,,,,,,,,,"Ugyi3K8nmvJSiSQmKZ54AaABAg.8WRTZuB2oeW8nEf5hUtzpH","red squirrel","/channel/UCx3FTmW9lCLi9cUOs57Nhhg","https://yt3.ggpht.com/a/AATXAJyhfcf3suRz-7EpFhcCYP0NfZT8-BxE4iOykw=s32-c-k-c0xffffffff-no-rj-mo","There are some but the price is too high.\n\nI knew or at least sort of knew an engineer/mechanic hear in the uk that built performance electric bikes as a side job.\nDidn't have the scale to make them cost effective though I think 5k for 90mph and 40 miles range with solar sides and a bike rather than motorcycle.\nNow theirs faster motorcycles with better range but all are more expensive.",0,"1 year ago",1553007965507,true
,,,,,,,,,,,,"Ugyi3K8nmvJSiSQmKZ54AaABAg.8WRTZuB2oeW8wnYlFOWXO4","Tanishq Srivastava","/channel/UCQsZsu2OOuWO3pk3sg0kwbQ","https://yt3.ggpht.com/a/AATXAJykvEfziBXkhpUW3qVZMh-e_67fyOZVoCTsQg=s32-c-k-c0xffffffff-no-rj-mo","Know we do... actually better than petrol",0,"8 months ago",1563548765510,false
"UgzYHwK1rPcJzfaW1sp4AaABAg","Robert Schuster","/channel/UCHP5GB8JwEH5PMKJUXrUgKw","https://yt3.ggpht.com/a/AATXAJyKbSGgV3ce_moWmK-76vNpQ6Z7fjhXFCKTLg=s48-c-k-c0xffffffff-no-rj-mo","I just don't like seeing arable land taken up by solar panels.  I like the rooftops and canal covers.  One thing not mentioned and maybe because they don't consider it renewable is LFTR technology.  I know India is working on it and I hope they get some plants into production soon for proof of concept so that other countries will follow their lead.",21,"2 years ago",1521471964929,false,true,"EkQSC3NrMG1ZSEhXbFlrwAEAyAEA4AEBogINKP___________wFAAMICGxoXaHR0cHM6Ly93d3cueW91dHViZS5jb20iABgGMk0aSxIaVWd6WUh3SzFyUGNKemZhVzFzcDRBYUFCQWciAggAKhhVQ2xrNTVzZElSQ3J4SHRKZTE3YmljQ2cyC3NrMG1ZSEhXbFlrQAFICg%3D%3D",5,,,,,,,,,
,,,,,,,,,,,,"UgzYHwK1rPcJzfaW1sp4AaABAg.8WQDXQnAiB88WSucvvwdkZ","Stephen Kelly","/channel/UC-NLSlBbQLPiJ54WZ45-H4g","https://yt3.ggpht.com/a/AATXAJwRxUwrhiALd8Ox0WDrjoqvDAVApRNB6GyPDw=s32-c-k-c0xffffffff-no-rj-mo","Robert Schuster Well those lands are really used so it's better to do it that way because most homes in India aren't strong enough to house an array of solar panels.",2,"2 years ago",1521471965426,false
,,,,,,,,,,,,"UgzYHwK1rPcJzfaW1sp4AaABAg.8WQDXQnAiB88WTncAHWo4i","Jay Patel","/channel/UCF_mmu980Pn8iW_Df0p6HkQ","https://yt3.ggpht.com/a/AATXAJw_xdHi3slwDLN2okufoJmSTnmCSDm4tJHMBA=s32-c-k-c0xffffffff-no-rj-mo","soon solar panel will be in most house because solar panel is getting cheap day by day and also indian government is giving subsidies in solar panel.",0,"2 years ago",1521471965426,false
,,,,,,,,,,,,"UgzYHwK1rPcJzfaW1sp4AaABAg.8WQDXQnAiB88WTrf48jDkY","gcKukie","/channel/UCMTsTqyHtSR-QlhY2PkdxxQ","https://yt3.ggpht.com/a/AATXAJzIg4lJ2sPUp-uf35dPMUOOaJxgiLccVWfnMg=s32-c-k-c0xffffffff-no-rj-mo","Where i live people grow ginseng under large nets, it would make total sense to build a solar farm that blocks the same amount of light as the netting for that situation, but i hear where your coming from, farmland is more important than people in the cities want to believe.",0,"2 years ago",1521471965427,false
,,,,,,,,,,,,"UgzYHwK1rPcJzfaW1sp4AaABAg.8WQDXQnAiB88WUM4CPCk7i","Robert Schuster","/channel/UCHP5GB8JwEH5PMKJUXrUgKw","https://yt3.ggpht.com/a/AATXAJyKbSGgV3ce_moWmK-76vNpQ6Z7fjhXFCKTLg=s32-c-k-c0xffffffff-no-rj-mo","Until all the roof tops are covered with solar panels, It just seems self defeating to make places where greenery can grow barren.  After all, plants do more to take carbon out of the air than anything else. If it's not a good area for food crops, at least trees or grass could grow there. The only places I can justify putting solar farms is out in an already barren area.",2,"2 years ago",1521471965427,false
,,,,,,,,,,,,"UgzYHwK1rPcJzfaW1sp4AaABAg.8WQDXQnAiB88mEcrTtufvj","neaz '","/channel/UCzxzRNyDYkLRH_JVGsgcvVg","https://yt3.ggpht.com/a/AATXAJx0wpcbDDcAyr_1xZZRCAbcvyNASpriykdzpg=s32-c-k-c0xffffffff-no-rj-mo","""cochin international airport"" have a look what they did",0,"1 year ago",1553007965428,false
"UgzlKjCWzKpUW2WZwMh4AaABAg","L Angermann","/channel/UCpCaB9qFfP3FNcKuzf4xzog","https://yt3.ggpht.com/a/AATXAJx_b9FKt4DDiiVyjngWhX5ivHAT05zzmgF_EQ=s48-c-k-c0xffffffff-no-rj-mo","...how did I get here? (._. ) ( ._.) Ehh whatever..its something to watch",15,"2 years ago",1521471964930,false,true,"EkQSC3NrMG1ZSEhXbFlrwAEAyAEA4AEBogINKP___________wFAAMICGxoXaHR0cHM6Ly93d3cueW91dHViZS5jb20iABgGMk0aSxIaVWd6bEtqQ1d6S3BVVzJXWndNaDRBYUFCQWciAggAKhhVQ2xrNTVzZElSQ3J4SHRKZTE3YmljQ2cyC3NrMG1ZSEhXbFlrQAFICg%3D%3D",2,,,,,,,,,
,,,,,,,,,,,,"UgzlKjCWzKpUW2WZwMh4AaABAg.8WPTA5Ob8Yf8W_ZSeSTzxw","filonin2","/channel/UCF5-UkPMkE5JGefUq1nWq2w","https://yt3.ggpht.com/a/AATXAJyJvvz4u5vgWsqjsyOWC7S2SMLTYw7SRAmIAA=s32-c-k-c0xffffffff-no-rj-mo","Right? It was actually so good I subbed.",2,"2 years ago",1521471965399,false
,,,,,,,,,,,,"UgzlKjCWzKpUW2WZwMh4AaABAg.8WPTA5Ob8Yf8W_ffBfsHZs","L Angermann","/channel/UCpCaB9qFfP3FNcKuzf4xzog","https://yt3.ggpht.com/a/AATXAJx_b9FKt4DDiiVyjngWhX5ivHAT05zzmgF_EQ=s32-c-k-c0xffffffff-no-rj-mo","filonin2 yeah totally, best thing to ever happen to me in live . I mean, dayum, thats some sweet content ;)",2,"2 years ago",1521471965400,false