"id","author","authorLink","authorThumb","text","likes","time","timestamp","edited","hasReplies","repliesToken","numReplies","reply.id","reply.author","reply.authorLink","reply.authorThumb","reply.text","reply.likes","reply.time","reply.timestamp","reply.edited"
,,,,,,,,,,,,"UgyNShixWXni-5U_NZ54AaABAg.8m0SKPNm41P9-h2B5Y2B71","Benaifer Surti","/channel/UCnS7dKBq28yOMZhPQMu-HGA","https://yt3.ggpht.com/a/AATXAJx2DZ-nKe-FoujKWmG7VU0M9gqS5AV6eDs4yQ=s32-c-k-c0xffffffff-no-rj-mo","https://youtu.be/P0BTHFF8ENI\nSolar cells have limitations, can work only in SUNSHINE... See the above link of Hydro Electric cells developed by team of INDIAN Scientists ""Miracle -Made in India""",2,"5 months ago",1571497563914,false
,,,,,,,,,,,,"UgyNShixWXni-5U_NZ54AaABAg.8m0SKPNm41P9-jTy7VkE0l","Pranav Anil","/channel/UCmyF1nORBTs66Hkh1HAMZUQ","https://yt3.ggpht.com/a/AATXAJyWzcE6ipCKz6faOraEF7qj065rATbT4vWcYA=s32-c-k-c0xffffffff-no-rj-mo","In which state, district and city are you living?\n\nPlease tell",0,"5 months ago",1571497563914,false
,,,,,,,,,,,,"UgyNShixWXni-5U_NZ54AaABAg.8m0SKPNm41P90q20B9Ok5o","Kussh Singh","/channel/UCs6j_zNLZRggBoNwUfUzQIw","https://yt3.ggpht.com/a/AATXAJxPLk2h2gq4lSUVfY_nnX56dvUl-d0r-LUm3g=s32-c-k-c0xffffffff-no-rj-mo","Cost of your home project is not mentioned. Whether battery is there or not? When started? What subsidy you got? What technology and vendor you have used in the solar panel or solar water heaters, electronics, batteries etc. How do you keep data metrics if any? What is the annual capacity fade of your solar panels? Are you using micro inverters with each panel or a single taiwanese inverter? ( make and model of inverter, year of manufacture, cost, service vendor in india etc)",0,"4 months ago",1574175964193,false
"UgynoNjgNl2DT1J4cst4AaABAg","Bhushan","/channel/UCf1WsozGik026mqMBGV2EiA","https://yt3.ggpht.com/a/AATXAJzXIy_fpDtETweGFN8FaGZnDTTW72eTu2ed7Q=s48-c-k-c0xffffffff-no-rj-mo","Its all good but India need alot more solar plants but the rates have gones below 3rs and roi is above 7-9 years now if Indian gov just give 4rs per unit like they do to coal plants there will be alot more growth i was looking into 1mw plant but less than 3rs is bad i dont think i will open that 1mw plant anytime soon",1,"1 year ago",1553007963462,false,false,,,,,,,,,,,
"UgwAkxvid6rBCS6kfAB4AaABAg","sagar sarkar","/channel/UChyiMP3kktes7NMDBRtUBoA","https://yt3.ggpht.com/a/AATXAJza2GwEDgOXoORTZE2bk0nMlZu3DxjP9TdITA=s48-c-k-c0xffffffff-no-rj-mo","India new era start....",1,"1 year ago",1553007963463,false,false,,,,,,,,,,,
"UgzhL4q_Nh-l5vRTEg54AaABAg","Mike Rock","/channel/UCSJiN1HfaeTe8PcsyFLhqjA","https://yt3.ggpht.com/a/AATXAJy-rBCbwg7tx13dOOcuBdNdRGSyoBdwBifiiQ=s48-c-k-c0xffffffff-no-rj-mo","Us needs to get the ass in gear an go green",14,"1 year ago",1553007963465,false,true,"EkQSC3NrMG1ZSEhXbFlrwAEAyAEA4AEBogINKP___________wFAAMICGxoXaHR0cHM6Ly93d3cueW91dHViZS5jb20iABgGMk0aSxIaVWd6aEw0cV9OaC1sNXZSVEVnNTRBYUFCQWciAggAKhhVQ2xrNTVzZElSQ3J4SHRKZTE3YmljQ2cyC3NrMG1ZSEhXbFlrQAFICg%3D%3D",2,,,,,,,,,
,,,,,,,,,,,,"UgzhL4q_Nh-l5vRTEg54AaABAg.8jTrvzDDysO8lXseXfk-St","Kim sung Un","/channel/UC78MsRxh__fQoNXLptHQ9VA","https://yt3.ggpht.com/a/AATXAJxq15yOvhQhS6YYg5H7ijVYr7FcvNLMHEpbyw=s32-c-k-c0xffffffff-no-rj-mo","But the stupid buffoon at the white house hates renewable energy",5,"1 year ago",1553007963795,false
,,,,,,,,,,,,"UgzhL4q_Nh-l5vRTEg54AaABAg.8jTrvzDDysO8nEcw3pc_jw","red squirrel","/channel/UCx3FTmW9lCLi9cUOs57Nhhg","https://yt3.ggpht.com/a/AATXAJyhfcf3suRz-7EpFhcCYP0NfZT8-BxE4iOykw=s32-c-k-c0xffffffff-no-rj-mo","@Kim sung Un He talks about actually bringing back coal with all the health risks and pollution.",0,"1 year ago",1553007963797,false
"Ugy3YlYEAeyyjXr0unB4AaABAg","Ashish Gupta","/channel/UCPGy6jGOBfjbSpiboOkuarA","https://yt3.ggpht.com/a/AATXAJwK2Sfef2uc8n_jNkeKb7PV4SUoDcoYKE74AQ=s48-c-k-c0xffffffff-no-rj-mo","very nice video",0,"1 year ago",1553007963467,false,false,,,,,,,,,,,
"UgxrSyzAWXH0Ls2rY4d4AaABAg","Rupali Sethi","/channel/UCGfhBKC8SAhWOk3yfCRXblA","https://yt3.ggpht.com/a/AATXAJyhzF0ArSVGSbqsuODBhf7KTpg0-F1NMQk1wA=s48-c-k-c0xffffffff-no-rj-mo","Awesome...m proud of my Bharat😊😊",4,"1 year ago",1553007963469,false,false,,,,,,,,,,,
"UgwALLWeea-uTvKhdjx4AaABAg","Rikki Malik","/channel/UCMEEHfY6ffbq0rhgkCSlj6A","https://yt3.ggpht.com/a/AATXAJz669dpJNvOdpI2uXY8iD_5rMnc99B-rADFjQ=s48-c-k-c0xffffffff-no-rj-mo","Reality is different than your advertisement.",2,"1 year ago",1553007963470,false,true,"EkQSC3NrMG1ZSEhXbFlrwAEAyAEA4AEBogINKP___________wFAAMICGxoXaHR0cHM6Ly93d3cueW91dHViZS5jb20iABgGMk0aSxIaVWd3QUxMV2VlYS11VHZLaGRqeDRBYUFCQWciAggAKhhVQ2xrNTVzZElSQ3J4SHRKZTE3YmljQ2cyC3NrMG1ZSEhXbFlrQAFICg%3D%3D",4,,,,,,,,,
,,,,,,,,,,,,"UgwALLWeea-uTvKhdjx4AaABAg.8hdPe-Qmx-y8k5UFtYAVn2","NIGHT WING","/channel/UCi2XNOV3P7WGSQfAaagq4yA","https://yt3.ggpht.com/a/AATXAJw87iJWw61iiXNgekk1Yn4DQv7XJVz8K9DKzQ=s32-c-k-c0xffffffff-no-rj-mo","Rikki Malik oh come on 30 percent of energy of india is already generate by renewable energy source",2,"1 year ago",1553007963801,false
,,,,,,,,,,,,"UgwALLWeea-uTvKhdjx4AaABAg.8hdPe-Qmx-y8lXtB_7-XfD","Kim sung Un","/channel/UC78MsRxh__fQoNXLptHQ9VA","https://yt3.ggpht.com/a/AATXAJxq15yOvhQhS6YYg5H7ijVYr7FcvNLMHEpbyw=s32-c-k-c0xffffffff-no-rj-mo","you live in Rahul Gandhi's pants? his wind turbine is not working properly cuz it's too small",5,"1 year ago",1553007963802,false
,,,,,,,,,,,,"UgwALLWeea-uTvKhdjx4AaABAg.8hdPe-Qmx-y8lY3ciCEF_a","NIGHT WING","/channel/UCi2XNOV3P7WGSQfAaagq4yA","https://yt3.ggpht.com/a/AATXAJw87iJWw61iiXNgekk1Yn4DQv7XJVz8K9DKzQ=s32-c-k-c0xffffffff-no-rj-mo","@Kim sung Un he don't even have one poor gay",0,"1 year ago",1553007963804,false
,,,,,,,,,,,,"UgwALLWeea-uTvKhdjx4AaABAg.8hdPe-Qmx-y8mCs0yLHZs8","Pakiyon ke Abba","/channel/UC-yVaOA-0fJmgIRnsWyAnUQ","https://yt3.ggpht.com/a/AATXAJz94bPKLGvhbNATRdsDcy18O7VpszVBfHus7w=s32-c-k-c0xffffffff-no-rj-mo","+Tejas Shahane truth",0,"1 year ago",1553007963805,false
"UgwTRqndXEncJMJnKnp4AaABAg","Deivil007","/channel/UCyMrjJDfBWP0q_qLJg8YKBg","https://yt3.ggpht.com/a/AATXAJxO7unuAgCebWDYP1vixvjROloTeuiNob71dg=s48-c-k-c0xffffffff-no-rj-mo","good job and good luck in the future india love from romania",142,"2 years ago",1521471963471,false,true,"EkQSC3NrMG1ZSEhXbFlrwAEAyAEA4AEBogINKP___________wFAAMICGxoXaHR0cHM6Ly93d3cueW91dHViZS5jb20iABgGMk0aSxIaVWd3VFJxbmRYRW5jSk1KbktucDRBYUFCQWciAggAKhhVQ2xrNTVzZElSQ3J4SHRKZTE3YmljQ2cyC3NrMG1ZSEhXbFlrQAFICg%3D%3D",4,,,,,,,,,
,,,,,,,,,,,,"UgwTRqndXEncJMJnKnp4AaABAg.8d_P5qdIfiB8mCsJKIeUxb","Pakiyon ke Abba","/channel/UC-yVaOA-0fJmgIRnsWyAnUQ","https://yt3.ggpht.com/a/AATXAJz94bPKLGvhbNATRdsDcy18O7VpszVBfHus7w=s32-c-k-c0xffffffff-no-rj-mo","thanks",0,"1 year ago",1553007963786,false
,,,,,,,,,,,,"UgwTRqndXEncJMJnKnp4AaABAg.8d_P5qdIfiB8mutojxO-yB","zodiacfml","/channel/UCww-RHPfKP_9bhNPtzeNPKw","https://yt3.ggpht.com/a/AATXAJwK9D_UXcDPJN7WeorN2_7oOCoXIl2HUjX6Wg=s32-c-k-c0xffffffff-no-rj-mo","india should manufacture panels and turbines!",1,"1 year ago",1553007963788,false
,,,,,,,,,,,,"UgwTRqndXEncJMJnKnp4AaABAg.8d_P5qdIfiB8yAFcIyJnIM","Sajeesh TP","/channel/UCiUOQo5Ez1h9k84A8mKqMww","https://yt3.ggpht.com/a/AATXAJy8uXH-hAjan2rtRNyADgGm_7i04FzpAoQMfw=s32-c-k-c0xffffffff-no-rj-mo","I have question is desalinating possible with solar energy I mean machine plant",0,"7 months ago",1566227163789,false
,,,,,,,,,,,,"UgwTRqndXEncJMJnKnp4AaABAg.8d_P5qdIfiB93qXrz5sXEB","Samrat Kaushik","/channel/UCKLaSHiTnNV2PXYYDIyZhAA","https://yt3.ggpht.com/a/AATXAJyhfy_WW0mAMzesFvbiyW4crlnGJkMhbHLrUg=s32-c-k-c0xffffffff-no-rj-mo","@zodiacfml yes brother it manufactur under bhel haridwar",0,"2 months ago",1579446363791,false
"UgyZQ37AFFiG70Lh4-F4AaABAg","mohsin22may","/channel/UCLrl2gOY6isCSqh7XWgtGmg","https://yt3.ggpht.com/a/AATXAJz10STzIvyCDZACP6Wox_Su24QLDxmOXd60dQ=s48-c-k-c0xffffffff-no-rj-mo","Levelized cost of electricity qouted in this video is calculated for which plant ?",2,"2 years ago",1521471963473,false,false,,,,,,,,,,,
"UgxpuM3oGfa4jvRD4vZ4AaABAg","M M","/channel/UCTHGRqZ76t_S9EhIxXiZsGg","https://yt3.ggpht.com/a/AATXAJxscTOIGBo1UApwwZX9impI3IXsSfpjV6kuLg=s48-c-k-c0xffffffff-no-rj-mo","Go INDIA",5,"2 years ago",1521471963474,false,false,,,,,,,,,,,
"UgxJcw3ovL8uvObBwkZ4AaABAg","Sangeet Jha","/channel/UCOwukN1P3dzud41YAOcepLw","https://yt3.ggpht.com/a/AATXAJxC3L9nWq19JELxr_3bx9HiHiFl2ptAj3YgMA=s48-c-k-c0xffffffff-no-rj-mo","Net meter scheme will be a success . But not seeing solar panels on rooftop..",0,"2 years ago",1521471963474,false,false,,,,,,,,,,,
"UgzWqUu8syANj_wTC0t4AaABAg","Gourab Das","/channel/UCnzzP56d7XgcbZW5Cq-_aSg","https://yt3.ggpht.com/a/AATXAJzETQChDZfDO_sBTUHS_BYT_QyciUhqwLCS3Q=s48-c-k-c0xffffffff-no-rj-mo","Modi modi modi.... U march ahead.... 1.25 billion Indian are with you... U are our hope... Our pride..",24,"2 years ago",1521471963475,false,false,,,,,,,,,,,
"Ugy8CRvm_Yoecsf3edx4AaABAg","Omniwave","/channel/UCWYZbwkjVKgAkOF9zlECF9w","https://yt3.ggpht.com/a/AATXAJyFWc3KHjzAxrf3p3ewa96d4RLOz6YQVeewRQ=s48-c-k-c0xffffffff-no-rj-mo","Oh that one house song at the beginning rules",2,"2 years ago",1521471964915,true,false,,,,,,,,,,,
"UgxKagkyBr2xBU6LKNx4AaABAg","cleric7788","/channel/UCBxJvHe2TXNOMIDSnT4Af6w","https://yt3.ggpht.com/a/AATXAJxaB6qAIWw95mfUTD5IgVTe39yiESf0kFKlNA=s48-c-k-c0xffffffff-no-rj-mo","3:50 backward communities. LOL",6,"2 years ago",1521471964915,false,true,"EkQSC3NrMG1ZSEhXbFlrwAEAyAEA4AEBogINKP___________wFAAMICGxoXaHR0cHM6Ly93d3cueW91dHViZS5jb20iABgGMk0aSxIaVWd4S2Fna3lCcjJ4QlU2TEtOeDRBYUFCQWciAggAKhhVQ2xrNTVzZElSQ3J4SHRKZTE3YmljQ2cyC3NrMG1ZSEhXbFlrQAFICg%3D%3D",3,,,,,,,,,
,,,,,,,,,,,,"UgxKagkyBr2xBU6LKNx4AaABAg.8_KLDZeGosH8k7jO6ZmmM0","instant sports","/channel/UC37IjX_jPKuwnLGOyXYQcow","https://yt3.ggpht.com/a/AATXAJw2Flohhu6FzEzcQf7mYo5VLbtjUk9GAZIttg=s32-c-k-c0xffffffff-no-rj-mo","cleric7788 western propoganda lol",1,"1 year ago",1553007965562,false
,,,,,,,,,,,,"UgxKagkyBr2xBU6LKNx4AaABAg.8_KLDZeGosH8lXsmsxn-yS","Kim sung Un","/channel/UC78MsRxh__fQoNXLptHQ9VA","https://yt3.ggpht.com/a/AATXAJxq15yOvhQhS6YYg5H7ijVYr7FcvNLMHEpbyw=s32-c-k-c0xffffffff-no-rj-mo","poor communities",2,"1 year ago",1553007965563,false
,,,,,,,,,,,,"UgxKagkyBr2xBU6LKNx4AaABAg.8_KLDZeGosH8mVUZWu_jPn","Paritosh Pandey","/channel/UCyI8oSkKMw_vw4MNk2fISqw","https://yt3.ggpht.com/a/AATXAJzuXefLPE-P8yirFvCuIIQwrfL35fZwEad_xA=s32-c-k-c0xffffffff-no-rj-mo","West love to see dark side of India",2,"1 year ago",1553007965564,true
"UgxbiT2dnNc1y3yPmoZ4AaABAg","EDWARD BEAVEN","/channel/UCRgxvhbE4vpOccVXXJGQ3ew","https://yt3.ggpht.com/a/AATXAJwuZRWgZtRWs3ZHWsBMkP9sQwhUsvPYZVs-cg=s48-c-k-c0xffffffff-no-rj-mo","WOW! Keep up the amazing work India - what I saw is world-changing",14,"2 years ago",1521471964916,false,false,,,,,,,,,,,
"UgzuHkbPIYIhwGEpAdh4AaABAg","Lane Gaspar","/channel/UCNx97HpgIzZdtpxOSC3ItVw","https://yt3.ggpht.com/a/AATXAJw5PFysJjcfyXdVrS9j0XlIzSLp6IYGz_fykg=s48-c-k-c0xffffffff-no-rj-mo","Last month my electric bill was $300. It appeared absurd to me that it would reach this high. I needed to do something about it. Through the generating power technique “boma fetching unique” (Google it), my power bill is now diminished by around 60% because I was able to produce power, also. And that is not just temporarily-that`s forever.",12,"2 years ago",1521471964917,false,true,"EkQSC3NrMG1ZSEhXbFlrwAEAyAEA4AEBogINKP___________wFAAMICGxoXaHR0cHM6Ly93d3cueW91dHViZS5jb20iABgGMk0aSxIaVWd6dUhrYlBJWUlod0dFcEFkaDRBYUFCQWciAggAKhhVQ2xrNTVzZElSQ3J4SHRKZTE3YmljQ2cyC3NrMG1ZSEhXbFlrQAFICg%3D%3D",2,,,,,,,,,
,,,,,,,,,,,,"UgzuHkbPIYIhwGEpAdh4AaABAg.8_0U591Fkah9-sYhuMGooT","Final Word","/channel/UCRfpFcmR1YjGVgN5ChW9rJg","https://yt3.ggpht.com/a/AATXAJzRqMTulvrXZ5TcBYVe0Y9RgPAJTBh0lM2n7A=s32-c-k-c0xffffffff-no-rj-mo","In New Delhi, we get free Electric till 400 units. Thereafter,  5 Rs. ($0.05)/unit. It's almost free for us.",0,"5 months ago",1571497565447,false
,,,,,,,,,,,,"UgzuHkbPIYIhwGEpAdh4AaABAg.8_0U591Fkah90JL5ivDjhL","THE GAMING PRO BRO","/channel/UCDtnIW9t84au_HOvHaFqSqw","https://yt3.ggpht.com/a/AATXAJxZAdaf-OIq8fxSoUm2_KKAqH_x_o5L8J_3KA=s32-c-k-c0xffffffff-no-rj-mo","That's actually bad dude. If u get it free ,then the people will not value it. I'm from Goa ,and here the tariff is a little above 1rs for 1-100 units and increases thereafter.",1,"4 months ago",1574175965448,false
"UgyJKqBnPYjoK-bIBkF4AaABAg","Mickey The maltipoo","/channel/UC75K9haHgIxn1ps2Ov4Zd5g","https://yt3.ggpht.com/a/AATXAJzZtZhmKVsqSEePjMVYIfvfGmbNV79a6yL9uA=s48-c-k-c0xffffffff-no-rj-mo","👏🏾👏🏾👏🏾👏🏾👏🏾👏🏾👏🏾",2,"2 years ago",1521471964917,false,false,,,,,,,,,,,
"Ugx0qfEFKe26phm5eAd4AaABAg","replica","/channel/UCx0JZIvf-tGYc6VuvqVmGLg","https://yt3.ggpht.com/a/AATXAJyRw1OGhsKHR9uViHgS44LNu_9aP7HqPMj3cA=s48-c-k-c0xffffffff-no-rj-mo","when solarpanels are placed on fertile soil or water: no photosyntesis",2,"2 years ago",1521471964918,false,true,"EkQSC3NrMG1ZSEhXbFlrwAEAyAEA4AEBogINKP___________wFAAMICGxoXaHR0cHM6Ly93d3cueW91dHViZS5jb20iABgGMk0aSxIaVWd4MHFmRUZLZTI2cGhtNWVBZDRBYUFCQWciAggAKhhVQ2xrNTVzZElSQ3J4SHRKZTE3YmljQ2cyC3NrMG1ZSEhXbFlrQAFICg%3D%3D",2,,,,,,,,,
,,,,,,,,,,,,"Ugx0qfEFKe26phm5eAd4AaABAg.8XUFAAFffjx90JMEIpXX_i","THE GAMING PRO BRO","/channel/UCDtnIW9t84au_HOvHaFqSqw","https://yt3.ggpht.com/a/AATXAJxZAdaf-OIq8fxSoUm2_KKAqH_x_o5L8J_3KA=s32-c-k-c0xffffffff-no-rj-mo","There is a solar concepts called agrivoltaics. Tomato's , pepper is proved to grow quite well in this .",0,"4 months ago",1574175965476,false
,,,,,,,,,,,,"Ugx0qfEFKe26phm5eAd4AaABAg.8XUFAAFffjx90JMMjwr95J","THE GAMING PRO BRO","/channel/UCDtnIW9t84au_HOvHaFqSqw","https://yt3.ggpht.com/a/AATXAJxZAdaf-OIq8fxSoUm2_KKAqH_x_o5L8J_3KA=s32-c-k-c0xffffffff-no-rj-mo","The solar panels are about 3-5 metres high so tractors and all the work can be done without hassle. Its an interesting topic , look it up",0,"4 months ago",1574175965476,false
"Ugz6N1PpSmPs0eTpHAd4AaABAg","Wellington Boobs","/channel/UCNmApdgmddUe2HX4gF_pZFw","https://yt3.ggpht.com/a/AATXAJysKGsJEj2_1nAqRP_UpWOH9DHJpd1QkWMKMQ=s48-c-k-c0xffffffff-no-rj-mo","I guess it will go down as well as the same news about China: India has a better energy policy than the USA and Britain. Once the privatization aspect is cut out of the picture, there's no reason why the material capital for solar can't been worked for within a year or two. That means no energy / fuel bills whatsoever once public ownership is gained of the industries that produce renewable energy equipment. I think that's clearly a policy that will win major public support; now consider who is voting against it. Who is voting to make people unnecessarily pay for energy and who wants the payments? Aside from the huge bills, putting more than ten percent of people in energy poverty and many more struggling and worrying and constantly juggling finances to just about cope, how much in tax subsidies (public debt) are they claiming? What is the Real Cost of them poisoning the environment and everything dependent upon it? Are their lies about the known effects of their dirty business crimes against humanity? Should the people who 'work respectable jobs' in firms like these be allowed legal protection by the criminal corporation known as city of london, the wide-open 'secret city' within the City of London favoured for its crippling libel so-called laws (legal red tape based on hiding transnational corporate crimes)? https://www.theguardian.com/media/2017/sep/05/reputation-laundering-is-lucrative-business-for-london-pr-firms",5,"2 years ago",1521471964919,false,false,,,,,,,,,,,
"Ugy2YHHdjIIsga8Mz0d4AaABAg","Dilwar Hussain","/channel/UCRbQD4nnVGNmFKX-K_ugr2w","https://yt3.ggpht.com/a/AATXAJwGpXNRL4zMid9y9lD3tupnM041tUbn3-mHCQ=s48-c-k-c0xffffffff-no-rj-mo","Great work",3,"2 years ago",1521471964919,false,false,,,,,,,,,,,
"Ugzek_huO_l-kpJI9514AaABAg","San Tosh","/channel/UCig_ad-c3cT6dOwHTtMRbSg","https://yt3.ggpht.com/a/AATXAJw3DmIVPNExhHc18Mc656PjQGRAkQHNeVc_1Q=s48-c-k-c0xffffffff-no-rj-mo","Great job guys. This is a good start",15,"2 years ago",1521471964920,false,false,,,,,,,,,,,
"UgzuQIH3gaLw_xxKXQx4AaABAg","Keith Ng","/channel/UCwO8GCYd1D8zcBL0kY-181A","https://yt3.ggpht.com/a/AATXAJw_EkjndF6hUof10CZe4pzQ34kpQe0lscCKRA=s48-c-k-c0xffffffff-no-rj-mo","Not bad at all.  It's good to be alive today and know that we are cutting down on burning fossil fuels and moving towards sustainable growth.",47,"2 years ago",1521471964921,false,true,"EkQSC3NrMG1ZSEhXbFlrwAEAyAEA4AEBogINKP___________wFAAMICGxoXaHR0cHM6Ly93d3cueW91dHViZS5jb20iABgGMk0aSxIaVWd6dVFJSDNnYUx3X3h4S1hReDRBYUFCQWciAggAKhhVQ2xrNTVzZElSQ3J4SHRKZTE3YmljQ2cyC3NrMG1ZSEhXbFlrQAFICg%3D%3D",1,,,,,,,,,
,,,,,,,,,,,,"UgzuQIH3gaLw_xxKXQx4AaABAg.8WcVi-VRTfo8lXsd4zrHrk","Kim sung Un","/channel/UC78MsRxh__fQoNXLptHQ9VA","https://yt3.ggpht.com/a/AATXAJxq15yOvhQhS6YYg5H7ijVYr7FcvNLMHEpbyw=s32-c-k-c0xffffffff-no-rj-mo","But the stupid buffoon at the white house hates renewable energy",1,"1 year ago",1553007965486,false
"Ugy3PzFTX75onmO0SFJ4AaABAg","Vishal Dharaneppagoudar","/channel/UCIcDyIMNOQnoucMve--8Jyw","https://yt3.ggpht.com/a/AATXAJwMxmaj2FyGI0FgncDqfvBM6YEIK0esAfIqJw=s48-c-k-c0xffffffff-no-rj-mo","Happy to know about renewable energy sources in my country.... I just proud to be in this land...",50,"2 years ago",1521471964921,false,true,"EkQSC3NrMG1ZSEhXbFlrwAEAyAEA4AEBogINKP___________wFAAMICGxoXaHR0cHM6Ly93d3cueW91dHViZS5jb20iABgGMk0aSxIaVWd5M1B6RlRYNzVvbm1PMFNGSjRBYUFCQWciAggAKhhVQ2xrNTVzZElSQ3J4SHRKZTE3YmljQ2cyC3NrMG1ZSEhXbFlrQAFICg%3D%3D",1,,,,,,,,,
,,,,,,,,,,,,"Ugy3PzFTX75onmO0SFJ4AaABAg.8WboyrG_-hA8qH2IPi5P4t","Naresh Mandhala","/channel/UCKL3fytwpF0RiC3WFgXcnAA","https://yt3.ggpht.com/a/AATXAJyE5q8OqyLfH0zAW9hOapKt8Ahlv9ywuLjSqQ=s32-c-k-c0xffffffff-no-rj-mo","Please tell use of renewable energy",0,"1 year ago",1553007965446,false
"Ugxn42dCRFp_ar3pJKt4AaABAg","Thezebraherd","/channel/UC5aBJlspPgKgXMCY0kIo8Vw","https://yt3.ggpht.com/a/AATXAJxniGdFCGRqzTB59AMtV-thwwVTPTjRlYEwkA=s48-c-k-c0xffffffff-no-rj-mo","I am from the US I wish our goverment did more of this I'm going to invest in some private solar and wind companies though. I guess we just solve more problems in the private Sector here but I think renewable energy should be helped by goverment like national security I guess both is good.",84,"2 years ago",1521471964922,false,true,"EkQSC3NrMG1ZSEhXbFlrwAEAyAEA4AEBogINKP___________wFAAMICGxoXaHR0cHM6Ly93d3cueW91dHViZS5jb20iABgGMk0aSxIaVWd4bjQyZENSRnBfYXIzcEpLdDRBYUFCQWciAggAKhhVQ2xrNTVzZElSQ3J4SHRKZTE3YmljQ2cyC3NrMG1ZSEhXbFlrQAFICg%3D%3D",5,,,,,,,,,
,,,,,,,,,,,,"Ugxn42dCRFp_ar3pJKt4AaABAg.8WbWyRVF7FA8YoNG2SbHvZ","rajgoyal","/channel/UCd7st0B3ZYk2ChA9Xwuc-Wg","https://yt3.ggpht.com/a/AATXAJyt2xu1xpEukmgazq20JscQsJJE-kSb0qAyHQ=s32-c-k-c0xffffffff-no-rj-mo","Thezebraherd Yup, but the problem with USG is that they have been seized by the private enterprises. You the citizens of the United States can pressurize Washington DC to go for green energy.",2,"2 years ago",1521471965417,false
,,,,,,,,,,,,"Ugxn42dCRFp_ar3pJKt4AaABAg.8WbWyRVF7FA8mVUAt0Tv49","Paritosh Pandey","/channel/UCyI8oSkKMw_vw4MNk2fISqw","https://yt3.ggpht.com/a/AATXAJzuXefLPE-P8yirFvCuIIQwrfL35fZwEad_xA=s32-c-k-c0xffffffff-no-rj-mo","Your English reveals that you are not American ,I think you are immigrant...",0,"1 year ago",1553007965418,false
,,,,,,,,,,,,"Ugxn42dCRFp_ar3pJKt4AaABAg.8WbWyRVF7FA8mhR3ce1a7G","Dinsha Bakrolio","/channel/UClxc9cUpO4mZFk1quHXymGA","https://yt3.ggpht.com/a/AATXAJzdA866Z0kLskARcz1zNmsEKRq0e1j8S0zbKQ=s32-c-k-c0xffffffff-no-rj-mo","Thezebraherd -Our policy of current Admin will take us ten years back and country like China and India will lead the world in sector.",0,"1 year ago",1553007965419,false
,,,,,,,,,,,,"Ugxn42dCRFp_ar3pJKt4AaABAg.8WbWyRVF7FA8mhV8_z3MQ6","Paritosh Pandey","/channel/UCyI8oSkKMw_vw4MNk2fISqw","https://yt3.ggpht.com/a/AATXAJzuXefLPE-P8yirFvCuIIQwrfL35fZwEad_xA=s32-c-k-c0xffffffff-no-rj-mo","@Dinsha Bakrolio ,I wish that should not happen..\nChina is the biggest threat in Asia for sovergenity of other nations...\nUs is better than China as world leader...\nSince my country does not  have oil,so I am in favour of US",2,"1 year ago",1553007965420,true
,,,,,,,,,,,,"Ugxn42dCRFp_ar3pJKt4AaABAg.8WbWyRVF7FA8rWryDMBvHV","tim coppinger","/channel/UCyRMcfaWdMNrPhCBd368lYQ","https://yt3.ggpht.com/a/AATXAJwMYryCnAL-JJ9_GDmXbym__x-6NE_qUDdluw=s32-c-k-c0xffffffff-no-rj-mo","That’s capitalism for you.",0,"1 year ago",1553007965420,false
"UgxSWtZtvsaTZDj-tn14AaABAg","filonin2","/channel/UCF5-UkPMkE5JGefUq1nWq2w","https://yt3.ggpht.com/a/AATXAJyJvvz4u5vgWsqjsyOWC7S2SMLTYw7SRAmIAA=s48-c-k-c0xffffffff-no-rj-mo","India is sciencing the shit out of this.",3,"2 years ago",1521471964925,false,false,,,,,,,,,,,
"UgxryaArfNX556U1RLV4AaABAg","John My views","/channel/UCLoR2FqyhDJxoh1qVSYLx5A","https://yt3.ggpht.com/a/AATXAJxvZ50tYViajkQEPzDshzNOsQUQdIKtBcm9vQ=s48-c-k-c0xffffffff-no-rj-mo","I like the way India is using canals to place solar panels which not only saves space but will lower water losses.",159,"2 years ago",1521471964925,false,true,"EkQSC3NrMG1ZSEhXbFlrwAEAyAEA4AEBogINKP___________wFAAMICGxoXaHR0cHM6Ly93d3cueW91dHViZS5jb20iABgGMk0aSxIaVWd4cnlhQXJmTlg1NTZVMVJMVjRBYUFCQWciAggAKhhVQ2xrNTVzZElSQ3J4SHRKZTE3YmljQ2cyC3NrMG1ZSEhXbFlrQAFICg%3D%3D",5,,,,,,,,,
,,,,,,,,,,,,"UgxryaArfNX556U1RLV4AaABAg.8WYcVFTjbqr8WduXprJoAi","George Hoyle","/channel/UCLcwIyZgC0Gd6EnsujZj5Fw","https://yt3.ggpht.com/a/AATXAJyqEolg-ll4nFfO3W5GNoy5lsK0jOfg_317jg=s32-c-k-c0xffffffff-no-rj-mo","John My views another trick smart business owners are doing is using solar panels as shade for parked cars in parking lots",28,"2 years ago",1521471965481,false
,,,,,,,,,,,,"UgxryaArfNX556U1RLV4AaABAg.8WYcVFTjbqr8XhJto_wJck","Cad Reg","/channel/UCluhEaHWP1DDVLm0T6UYuVw","https://yt3.ggpht.com/a/AATXAJycjDQpfDRB5aiMCIRNIEAzYcE8huS_e4nbfQ=s32-c-k-c0xffffffff-no-rj-mo","How does it reduce water loss.?\nBesides, I don't see any point is covering canals.. there is huge amount of rooftop.. that can be used!",2,"2 years ago",1521471965482,false
,,,,,,,,,,,,"UgxryaArfNX556U1RLV4AaABAg.8WYcVFTjbqr8YoLlg6SZHe","rajgoyal","/channel/UCd7st0B3ZYk2ChA9Xwuc-Wg","https://yt3.ggpht.com/a/AATXAJyt2xu1xpEukmgazq20JscQsJJE-kSb0qAyHQ=s32-c-k-c0xffffffff-no-rj-mo","Cad Reg it saves a lot of water. FYI temperature in India reaches above 40° Celsius. Covering them results in less evaporation and ultimately saving the water.",21,"2 years ago",1521471965483,false
,,,,,,,,,,,,"UgxryaArfNX556U1RLV4AaABAg.8WYcVFTjbqr8a1TaqmJ3S4","Jake Ryker","/channel/UC2iFUxkWyLs4xobJ2HNTABQ","https://yt3.ggpht.com/a/AATXAJzfSDKkeTm96dAf7wFrd9yDauUYNcMa1dotsA=s32-c-k-c0xffffffff-no-rj-mo","Cad Reg Shielding from heat~",0,"2 years ago",1521471965483,false
,,,,,,,,,,,,"UgxryaArfNX556U1RLV4AaABAg.8WYcVFTjbqr8nNzwpXOXRD","Dharmawan Atmadja","/channel/UCzPc_lwAd4iVkS2PQp7svjQ","https://yt3.ggpht.com/a/AATXAJxEk1Y9mGmZmj-YTogjVdLtbWO4Lk6CutGTIA=s32-c-k-c0xffffffff-no-rj-mo","Mop",0,"1 year ago",1553007965484,false
"UgzRiRTtRXANXfAbr5h4AaABAg","eternitynaut","/channel/UCS_fRcKhPPOGXAvKo9TIpkQ","https://yt3.ggpht.com/a/AATXAJwdg0uFgsp2ImwGKbOkd23NE5Xu4VJdK5G-PA=s48-c-k-c0xffffffff-no-rj-mo","The largest democracy supporting renewable energy. You're the big great hope for the world.",193,"2 years ago",1521471964926,false,true,"EkQSC3NrMG1ZSEhXbFlrwAEAyAEA4AEBogINKP___________wFAAMICGxoXaHR0cHM6Ly93d3cueW91dHViZS5jb20iABgGMk0aSxIaVWd6UmlSVHRSWEFOWGZBYnI1aDRBYUFCQWciAggAKhhVQ2xrNTVzZElSQ3J4SHRKZTE3YmljQ2cyC3NrMG1ZSEhXbFlrQAFICg%3D%3D",1,,,,,,,,,
,,,,,,,,,,,,"UgzRiRTtRXANXfAbr5h4AaABAg.8WUCFGbr93S8lzSAQ-i2Se","Mr.CoolGuy","/channel/UClzPXjMmZvMFoineBu6o4yQ","https://yt3.ggpht.com/a/AATXAJyyRo_9NvMPOd1_7jsE2abaL23Mi8OIGu1oNA=s32-c-k-c0xffffffff-no-rj-mo","Lol",0,"1 year ago",1553007965450,false
"UgwOzxe-M5tIe2u1P654AaABAg","Jay Patel","/channel/UCF_mmu980Pn8iW_Df0p6HkQ","https://yt3.ggpht.com/a/AATXAJw_xdHi3slwDLN2okufoJmSTnmCSDm4tJHMBA=s48-c-k-c0xffffffff-no-rj-mo","we also should include wave energy. It can be replace by coal.",14,"2 years ago",1521471964927,false,true,"EkQSC3NrMG1ZSEhXbFlrwAEAyAEA4AEBogINKP___________wFAAMICGxoXaHR0cHM6Ly93d3cueW91dHViZS5jb20iABgGMk0aSxIaVWd3T3p4ZS1NNXRJZTJ1MVA2NTRBYUFCQWciAggAKhhVQ2xrNTVzZElSQ3J4SHRKZTE3YmljQ2cyC3NrMG1ZSEhXbFlrQAFICg%3D%3D",2,,,,,,,,,
,,,,,,,,,,,,"UgwOzxe-M5tIe2u1P654AaABAg.8WTpj_KWA6u8lXsjb0lRaC","Kim sung Un","/channel/UC78MsRxh__fQoNXLptHQ9VA","https://yt3.ggpht.com/a/AATXAJxq15yOvhQhS6YYg5H7ijVYr7FcvNLMHEpbyw=s32-c-k-c0xffffffff-no-rj-mo","not efficient at all",0,"1 year ago",1553007965379,false
,,,,,,,,,,,,"UgwOzxe-M5tIe2u1P654AaABAg.8WTpj_KWA6u90JLdRVZT62","THE GAMING PRO BRO","/channel/UCDtnIW9t84au_HOvHaFqSqw","https://yt3.ggpht.com/a/AATXAJxZAdaf-OIq8fxSoUm2_KKAqH_x_o5L8J_3KA=s32-c-k-c0xffffffff-no-rj-mo","What you mean is today energy and India doesnt have much potential for it. We have probably have 8000Mw of potential in India at Max. Its better to depend on wind and solar. There are many solar concepts out there to make the most out of the land. Wind is the most efficient RENEWABLE energy and that has a lot of potential as stated by the video. Hope you got your answer!",0,"4 months ago",1574175965379,false
"UgxupWdUomAFLmjMh9J4AaABAg","lexa 2t","/channel/UCBarMPRTZZ5D8hjy-wewcVw","https://yt3.ggpht.com/a/AATXAJzQ3LDXGk92X0jmIJGiky9pt0lXndnpPrbQQw=s48-c-k-c0xffffffff-no-rj-mo","Bravo ! India can become an example for other countries.",124,"2 years ago",1521471964928,false,true,"EkQSC3NrMG1ZSEhXbFlrwAEAyAEA4AEBogINKP___________wFAAMICGxoXaHR0cHM6Ly93d3cueW91dHViZS5jb20iABgGMk0aSxIaVWd4dXBXZFVvbUFGTG1qTWg5SjRBYUFCQWciAggAKhhVQ2xrNTVzZElSQ3J4SHRKZTE3YmljQ2cyC3NrMG1ZSEhXbFlrQAFICg%3D%3D",1,,,,,,,,,
